|Sentiment|Text|imdbReviewLinks|imdbMovieLink|imdbGenres
249|Negative|"I tried to like this program; I really did. I even bought the pilot film, first on VHS and later on DVD. However, I couldn't get into this story because its two main characters: ""David"" (Bruce Willis) and ""Maddie"" (Cybill Shepherd) just seemed to in love with themselves, for one thing. I admit was some clever dialog in the shows, which was a key part of the success of the TV program, and I did appreciate of lot of that dialog. <br /><br />Basically, this was almost like the old screwball comedy movies of the '30s and '40s with male versus female. You get lots of arguing, accusations, yelling and screaming. A lot of people apparently love that sort of bickering, but I hate it, so I never got on the Moonlighting bandwagon. <br /><br />Only Allyce Beasley as the hapless aide ""Agnes,"" was entertaining. It's too bad she had such little air time. Shepherd was nice on the eyes and I suppose women would say the same for Willis, but too much arguing between the two finally turned me off."|https://www.imdb.com/review/rw1657655/|https://www.imdb.com/title/tt0088571/|"""Comedy"",""Drama"",""Mystery"""
250|Negative|"This is one of the worst things to ever come out of England, so that says a lot right there. The tension when we have to find out whether or not Lembach is staying is amazing though. The upside is seeing the nice secretary, Sheila, in her picnic table print underwear for awhile after being captured by Dr. Rat Face. This movie has several views of London too although none of them are good. There is also a point in which there is almost a car accident which gets your heart rate back to just below normal. There is also a watch that gets teleported away, and the fear of the woman not getting her watch back is parallel to the horror of ""The Sixth Sense"" only a lot more dull and British. Add on a furious gun fight between the British police and the Dr. Rat, which results in nothing, plus the electrocuting of a lot of people, plus a cat and you have yourself... ummm... A British movie. The MST3K version is pretty good although not one of there bests."|https://www.imdb.com/review/rw1072008/|https://www.imdb.com/title/tt0062159/|"""Horror"",""Sci-Fi"""
251|Negative|This movie is a very poor attempt to make money using a classical theme. I used to love Superman movies, but this one made me want to shoot myself. Very poor acting, outrageous special effects, and a plot equal to zero. To summarize : Superman leaves earth, because scientists discovered pieces of his home planet, some were in space (duh) , doesn't tell his girlfriend anything before leaving (duh again), takes off in a spaceship (?!?),comes back i think 5 years later, and look forward to hooking up with his girlfriend again (who is now razing his son, which son, in my humble opinion is at least 7 years old). And what about that Lex Luthor ? Trying to grow a new continent in order to sell land ? Please !!<br /><br />I vote 1 out of 10 for this movie, only because i am not allowed to vote 0. If you have anything else to do with your time, don't go to see this movie, and even if you don't have anything else to do, stay home and watch TV !|https://www.imdb.com/review/rw1414313/|https://www.imdb.com/title/tt0348150/|"""Action"",""Adventure"",""Sci-Fi"""
252|Negative|"Brainless film about a good looking but brainless couple who decide to live their dream and take people on diving tours. The pair almost instantly make the wrong choice of customers and get mixed up with some people seeking to recover the items that we see falling to the ocean floor during the opening credits sequence. Great looking direct to video movie could have been so much better if it wasn't so interested in primarily looking good. Performances are serviceable and the plot is actually not bad, or would have been had the director and producers not redirected the plot into making sure we see lots of shapely people in bathing suits (or in what I'm guessing the reason for the ""unrated"" moniker a few fleeting bare breasts). The film never generates any tension nor rises above the level of a forgettable TV movie. If you get roped in to seeing this you won't pluck your eyes out since the eye candy is pleasant but we really need to stop producers from making films that are excuses to have a paid vacation."|https://www.imdb.com/review/rw2060386/|https://www.imdb.com/title/tt0865907/|"""Action"",""Adventure"",""Thriller"""
253|Negative|When i got this movie free from my job, along with three other similar movies.. I watched then with very low expectations. Now this movie isn't bad per se. You get what you pay for. It is a tale of love, betrayal, lies, sex, scandal, everything you want in a movie. Definitely not a Hollywood blockbuster, but for cheap thrills it is not that bad. I would probably never watch this movie again. In a nutshell this is the kind of movie that you would see either very late at night on a local television station that is just wanting to take up some time, or you would see it on a Sunday afternoon on a local television station that is trying to take up some time. Despite the bad acting, cliché lines, and sub par camera work. I didn't have the desire to turn off the movie and pretend like it never popped into my DVD player. The story has been done many times in many movies. This one is no different, no better, no worse. <br /><br />Just your average movie.|https://www.imdb.com/review/rw1417971/|https://www.imdb.com/title/tt0096182/|"""Action"",""Thriller"""
254|Negative|"""The fallen ones"" falls under the waste of life (WOL) category. I am sad that I am now two hours older was not entertained. My other family members also watched this movie and threw demeaning comments at the screen and rooted for the mummy. I felt sorry for the actors (Wagner). I have read other negative reviews and cannot add anything else to this movie other than it could be reduced to 25 minutes so it could take a 30 minute slot on TV without any loss of plot. It reminds me of a dish that has several good ingredients but when served is bland with no flavor at all. In my humble opinion, The 42 foot mummy should have been 8-10 feet and improved the plot by taking out the mystic and replacing him with several people who want to denigh the facts and want DNA samples for evil reasons. The heroes are discredited and tossed on there ear by their colleges. Later after everything was screwed up by the evil people. The heroes would save the day and prove everyone wrong."|https://www.imdb.com/review/rw1215287/|https://www.imdb.com/title/tt0421199/|"""Horror"""
255|Negative|"first of all let's start out by saying that Robert Englund Doug Bradley and Melinda Clark should be commended for having to be associated with this piece of drivel. i had to give this a 1 it wouldn't let me give it a zero. wanna know how bad this movie is? my mom calls me from across town and tells me ""son, i just watched the stupidest movie ever. i responded as saying ""the killer tongue huh?"" she was like how did you know that? that's how bad this movie is. i mean it looked like a good movie at first Freddy pinhead Melinda. okay i'll give it a chance. i sat through the rest of this movie only because i wrote a column for reviews of horror movies. i implore you, don't waste your time money or even brain cells on this ludicrous piece of crap. run away. far away. if you see it on the shelf at Hollywood video blockbuster or even your local video store, turn it around and walk away....and i still want my two hours back dang it"|https://www.imdb.com/review/rw1127726/|https://www.imdb.com/title/tt0116770/|"""Comedy"",""Sci-Fi"",""Horror"""
256|Negative|"I am an avid fan of horrendous movies, anything cheesy and down right ridiculous is my game. So imagine my spirit I went to the local Rent Shop, and found Vampires vs. Zombies. The name is just too entertaining, you know that no one in the world could pull off something like it, it just has to be bad.<br /><br />And boy, is it BAD. After viewing this horror-ific movie, I was speechless, literally. Me and my pal sat outside without saying a word to each other for several minutes, both of us contemplating the future of our lives after watching this movie. I broke the depressing silence with the words, ""...dude....What?"" Yes, i am an enthralling individual.<br /><br />Heres a quick 'street review' The Plot; There is none, at all, ever, constantly in ""WTF"" mode. The Characters; No development, forgettable. The Music; Worse than porn. The Vampires; Theirs vampires? The Zombies; Theirs Zombies?<br /><br />In the end; Everyone should see this movie, honestly, its so bad I yearn to see it again. So do yourself a favor, watch it and get Depressed."|https://www.imdb.com/review/rw1656373/|https://www.imdb.com/title/tt0408309/|"""Horror"""
257|Negative|I remember Devil Dog playing on TBS almost 20 years ago, and my older sister and her friends watching it and laughing all the next day. It's not that bad for a made-for-TV horror movie, but it is derivative (mostly of The Exorcist) and businesslike, for lack of a better word. It won't blow you away with artful cinematography or great acting, but it's not a waste of time, either. It's the kind of movie you watch to kill a couple of hours when you aren't in the mood to think too hard.<br /><br />However, if you go into the movie looking for some laughs, you won't be disappointed. The early scenes, with Lucky the Devil Dog as a cute little puppy with Children of the Damned eyes are hilariously non-threatening, and the climactic blue-screen effects of a giant black dog (with horns!) are pretty side-splitting. And keep an eye out for the cloaked Satanist in Maverick shades toward the beginning.<br /><br />Not a great horror film by any stretch of the imagination, but I wish they still made stuff like this for TV.|https://www.imdb.com/review/rw1284363/|https://www.imdb.com/title/tt0077429/|"""Horror"",""Thriller"""
258|Negative|"Closer to reality and containing more depth than ""Breakdance"", Stan Lathan's ""Beat Street"" is still a pretty dull show. Again this pic is really only cashing in on the 'breakin' craze but at least we get a little bit of entertainment from the plot, which concerns the lives of three young friends and a younger brother, all growing up in Queens, New York. Each has their own unique talent. One is a hustler, one a d.j., another an artist who creates 'burners', while little bro' Lee is a hot 'hip hop' dancer.<br /><br />Lathan is unable to generate any real audience interest in the story though, and his young cast are likewise struggling with their characters. Therefore it is left almost entirely to the funky music and the 'fresh' dancing to save the day.<br /><br />Choreography is again sharp for both club and street scenes, but this alone is not enough to lift """"Beat Street"" to greater heights. Unfortunately the film really falls flat late on, after showing a glimmer of hope that it just might get interesting.<br /><br />Sunday, August 25, 1996 - Video"|https://www.imdb.com/review/rw1847578/|https://www.imdb.com/title/tt0086946/|"""Drama"",""Music"""
259|Negative|"....as to the level of wit on which this comedy operates. Barely even reaching feature length, ""Can I Do It....'Till I Need Glasses"" is a collection of (mostly) dirty jokes. Many of them are so short that you can't believe it when you realize that THAT was supposed to be the punchline (example: the Santa Claus gag); others are so long that you can't believe it when you realize that they needed so much time to set up THAT punchline (example: the students' awards gag). And nearly all are directed without any artistry. Don't get me wrong: about 1 every 10 jokes actually manages to be funny (the iron / phone one is probably my favorite). There is also some wonderful full-frontal nudity that proves, yet again, that the female body, especially in its natural form, is the best thing on this planet (there is some comedic male nudity as well). And I agree with others that the intentionally stupid title song is actually pretty damn catchy! But none of those reasons are enough to give this film anything more than * out of 4."|https://www.imdb.com/review/rw2186660/|https://www.imdb.com/title/tt0075801/|"""Comedy"""
260|Negative|Stefan is an x-con that five years ago got married to Marie. Their marriage has been stable until Stefan past catch up with them and he's offered to do a courier job. Stefan's job is a heroin delivery from Germany to Sweden which should go easily.<br /><br />In Germany Stefan meet Elli, a girl from Bosnia that has been sold to a stripclub owner. Stefan dislikes what he sees and decide to help Elli out of her misery. Due to the fact that Elli's father during the war fleed to Sweden Elli now goes with Stefan to Sweden. To make up with the past Stefan promises Elli to help her find her father, no matter what it takes. Finally back in Sweden the whole situation seems to be more complicated than Stefan ever thought of..<br /><br />This movie doesn't seem to fit in the ordinary class of swedish movies due to the fact that it's been americanized alot. Regina Lund and Cecilia Bergqvist makes it all average, the effects makes the movie a little too much though. See it and jugde for yourself.<br /><br />|https://www.imdb.com/review/rw0762453/|https://www.imdb.com/title/tt0262418/|"""Action"",""Drama"",""Thriller"""
261|Negative|"Think a darker version of one of those kid shows such as ""Power Rangers"" and you have this film from 1990, ""Robot Jox"". A movie where you fight with giant robots, two men enter the arena and whoever comes out their country wins. The robots are huge and look like slightly better versions of the ones from said shows mainly because they are less colorful so while this movie is not good, it isn't all bad to watch. There are as I recall two robot fights in this one, one that ends badly and the final showdown. There is a plot twist part way through as a traitor is revealed, but in the end the plot is nothing that is going to stick with you for any amount of time after the picture is done. The fights themselves look like giant toys on the rampage, but still somewhat fun to watch. This movie would also spawn a couple of other films with similar plot devices such as the giant robots and the tournament. So it is worth checking out once, but probably not more than that."|https://www.imdb.com/review/rw1089428/|https://www.imdb.com/title/tt0102800/|"""Action"",""Sci-Fi"",""Thriller"""
262|Negative|"Expecting a combination of scifi and period film about Ada Lovelace, Charles Babbage, the history of computers, etc, I was disappointed by this movies nonsensical pseudoscience and mixture of real and fabulous history. It gives the impression that its writer (Lynn Hershman-Leeson) has no real understanding of the Math, technology, or history constituting the film's subject, but is working instead from a sort of fuzzy artistic impression of them. This hits a sore spot with me, as I've long been irritated by the tendency of the arts to glom onto and awfully misuse science terms and ideas to the point of confusion, eg: Emmy Coer: ""information waves have a half-life"", Ada: ""I'm not at all certain that half a life is better than no life at all"".<br /><br />This movie does worse than fail to entertain - it misinforms. The only redeeming value I can imagine for it is that it might attract a viewer to learn about the subject it so badly distorts. It's more likely, I think, to promote a superstitious perception of science and technology of any degree of advancement as indistinguishable from magic."|https://www.imdb.com/review/rw1312696/|https://www.imdb.com/title/tt0118882/|"""Drama"",""Fantasy"",""Sci-Fi"""
263|Negative|I saw this recently with my wife and discovered it's better than Caine believes, although it's not much cop. Britain's greatest ever screen actor does not seem too interested in this role, which is a pity as he might have elevated it with more conviction in his playing. Rex Harrison seems even less bothered, perhaps unsurprisingly, as his character is very poorly written. William Holden is better, but his screen time is fleeting and, again, his character is not well scripted.<br /><br />Beverly Johnson is as beautiful a woman as I have ever seen, but is given very little to do, the film might have gained a great deal by concentrating more on her story. Ustinov steals the show, but basically by playing a comic character quite out of keeping with the film's serious tone. The music is poor and Omar Sharif makes one of his many pointless cameos (his career has been based on this for decades now).<br /><br />Richard Fleischer has to be blamed for not directing this more effectively, he was an infuriatingly unpredictable film director, and this is one of his weaker movies.|https://www.imdb.com/review/rw1524439/|https://www.imdb.com/title/tt0078801/|"""Action"",""Adventure"",""Drama"""
264|Negative|"This self proclaimed ""very talented artist"" have directed easily the worst Spanish film of the 21st century. Lack of emotion, coherence, rhythm, skills, humor... it repeats the same situation over and over again. It shows no character development. It does not even show any violent and/or sexual content, and it does not add anything new to the psycho-killer sub genre. So lame it should be shown at film schools as an example of ""what not to do"" in a first movie.<br /><br />BTW where the hell is the ""talent""? there are scenes which have been shot almost identically; there are scenes which have two or more master shots and it is quite awful to see the action jumping from one master shot to another without a reason. The camera almost never moves, as if the ""very talented artist"" was afraid of showing his lack of visual skills. The actors playing the main roles act like amateurs, and the supporting cast is hardly believable. There are more holes than plot in the script (if ever there was one)...<br /><br />A really disheartening movie, and a whatsoever talented director."|https://www.imdb.com/review/rw1445294/|https://www.imdb.com/title/tt0455115/|"""Crime"",""Horror"",""Thriller"""
265|Negative|It's sad when you can see what a movie was attempting to do, and it is quite obvious that it fell far far short of the mark. Film students should take this as a lesson and a warning. Would be graduate has an idea. He wants total control. So he writes, directs, produces, his cinematic masterpiece all by himself. Usually, his concept is far beyond his budget. Usually he writes an overblown script full of every tag line he can come up with. Usually, he is more interested in the grand sweep of the story rather than on the nitty gritty of working with actors on individual scenes. Usually, he ends up with a movie that is feeble in it's attempt to create miracles on a tiny budget. Usually, he ends up with a series of encounters (we cannot do justice by calling them scenes) that feel like they were written by a 12 year old. And usually he ends up with badly acted scenes that fail to grab the viewer. When you look at Judges from this perspective you can immediately tell it's just the usual fare.|https://www.imdb.com/review/rw2108863/|https://www.imdb.com/title/tt0460838/|"""Action"",""Adventure"",""Fantasy"""
266|Negative|This film, for an after school special, isn't that bad, and that's the problem. Nothing happens. You feel as if you're still in class. A guy teaches a bunch of young underdogs how to be good paint ball players. We never get to see these underdogs doing badly as the good player is training them. They all of the sudden turn into good players by meditating. Also there are too many characters and no character development. Too much time is spend on the main character and his sexy sister and not enough on some of the other kids. This could have had a 'Bad News Bears' feel (the original) since there was a girl on an all boys team, but there wasn't any feel to this movie at all. It has no feeling and leaves a dull pain in your bones after watching it, is not fun to bag on, not fun to watch, and is just kind of... there. Plain. Boring. Something you'd watch after school before your pre-evening nap. As dull as the day is long and it's been a long, long day watching this movie.|https://www.imdb.com/review/rw1471621/|https://www.imdb.com/title/tt0327940/|"""Action"""
267|Negative|"There is only one use for a film such as Bulletproof: it reminds you just how bad bad can be. We often see films which we describe as ""pretty awful"" or ""not much good"", but then you come across a film like this and you can see that although all those other films aren't ""good"" they are no way as stinkingly bad as Bulletproof. This was a birthday gift from someone who spent less than two seconds rummaging thru' the DVD bargain bin at our local superstore to fulfil an obligation (i.e. to give me a present). It could have been a serendipitous find but it wasn't: this is so utterly clichéd, so badly written, so poorly directed, so badly acted that I'm surprised everyone involved hasn't been arrested and sent down for 10 years. God, it's awful. I suspected as much from about 30 seconds in, but carried on because sometimes - sometimes - bad films are so bad they can be enjoyable. This isn't one of them. It is simply bad. I stopped watching after 45 minutes, and tomorrow I shall throw it in the bin."|https://www.imdb.com/review/rw1535256/|https://www.imdb.com/title/tt0094813/|"""Action"""
268|Negative|"SAKURA KILLERS (1+ outta 5 stars) Maybe in 1987 this movie might have seemed cool... if you had never ever seen a *good* ninja movie. Cheesy '80s music... cheesy dialogue... cheesy acting... and way-beyond-cheesy martial arts sequences. The coolest scene is at the beginning... with an aged Chuck Connors playing golf on a beach... several black clad ninjas try to sneak up on him and it looks like he is too intent on hitting his ball to notice... suddenly he reaches into his golf bag and... naw, I won't spoil it for you... if you ever have the misfortune of seeing this movie you'll thank me. The story is a lot of nonsense about some stolen videotape or something. A bunch of dim-bulb Caucasian heroes are trained in the ways the ninja because ""only a ninja can fight a ninja"" or something like that. Strange, these guys don't seem to fight any better after their training than before... oh well, the movie does move along pretty briskly. The fight scenes may not be great.. but they are plentiful... and the overdone sound effects are good for a few chuckles."|https://www.imdb.com/review/rw1135824/|https://www.imdb.com/title/tt0093910/|"""Action"""
269|Negative|"This movie is not as good as all the movies of Christ I've ever seen. And I'm quite amazed that in this story Pilate wants to finish Jesus, when the Scriptures (as well the other movies) state differently. It lacks also a very important issue: The Resurrection.. None of the other movies skip this very important part: the faith of all of us Christians lies in this very event. As Paul says in one of his letters ""If Christ did not rise from the dead, our faith is vain"". A very impressive scene for me in this movie was seeing on the streets the remains of the palms that were used when Jesus entered Jerusalem. <br /><br />Finally, and in opposition to my Jewish co-commentator, Jesus WAS NOT a myth. And as a matter of fact, he was also a JEW. There are plenty of documents (relgious and secular) that prove the existence of this extraordinary man(or should I said, God become a man) that indeed changed mankind. I strongly advise him(given he is a historian) to read about Flavius Josephus, the most brilliant Jewish commentator of the 1st. Century."|https://www.imdb.com/review/rw1343673/|https://www.imdb.com/title/tt0080595/|"""Drama"""
270|Negative|"This movie is without a doubt the worst horror movie I've ever seen. And that's saying a lot, considering I've seen such stinkers like Demon of Paradise, Lovers' Lane, and Bloody Murder (which is a close second). However, I love bad horror movies, and as you can tell from my username, this one really sticks out. At times there's nothing more entertaining than a poorly made slasher flick. As for this film, the opening scene in which a woman gets fried in a tanning booth appears to have no bearing on the film whatsoever, especially since the movie fails to tell you that the event happened 2 years prior to the rest of the film. The acting is nonexistent, and most of the camera shot are of women's areas shrink wrapped in spandex. The policeman was the most stone-faced, monotone actor I've ever seen. The best/worst part of this movie, however, has to be the murder weapon. A giant safety pin?! What were they thinking? Who's the killer? A disgruntled ""Huggies"" employee? I'd have to give this movie an overall zero, but darned if I didn't have a blast watching it"|https://www.imdb.com/review/rw0234144/|https://www.imdb.com/title/tt0091339/|"""Horror"""
