|Sentiment|Text|imdbReviewLinks|imdbMovieLink|imdbGenres
391|Negative|This movie is lame and not funny at all. The plot doesn't even make sense. Some scientist who works on the fringes of science opens a doorway to another dimension (maybe hell???) and his daughter gets sucked through it or something, then one day for no apparent reason she comes back and now she has big breasts and wears a skimpy outfit (I guess the demons in the other dimension made it for her?) The main character is a guy who wants to marry his girlfriend but she is gay so obviously she's more interested in her new girlfriend, and they stumble upon this witch spell book (they want to be witches or something???) and the evil spell ends up getting read again which is how the evil demon comes to earth which only the bikini top girl and the spurned guy in love can stop apparently. There is topless scenes for no reason and a guy in it who my boyfriend says is a well known wrestler but his part is completely unnecessary, obviously they made something up just to put him in it because then maybe wrestling fans will actually watch this pointless movie. I'm sure the topless girls doesn't hurt there either. The extra features on the DVD were even more confusing than the rest of the movie, I thought it might help explain what was going on but it actually just made things more confusing. Who are these people and what are they doing? Basically this is a go-camping-to-make-out-then-fight-a-monster movie but there are a bunch of things (like the other dimension and book seller) than make it confusing. I didn't like the movie but it was only like five bucks so big deal. I don't recommend watching it though it was just too stupid, I can't think of any part of the movie that was good.|https://www.imdb.com/review/rw1917491/|https://www.imdb.com/title/tt0949379/|"""Comedy"",""Horror"""
392|Negative|"It was Jon Pertwee who said "" It`s very difficult to be funny but very easy to be silly "" . Well if that`s the case PASTY FACES is "" Very easy "" . David Baker ( As Director /Screenwriter ) and his cast seem to be under the impression that comedy involves stealing scenes and style from superior Britcoms like LOCK STOCK.. and TRAINSPOTTING , using a completely underdeveloped script and jumping up and down speaking in a very fast voice very loudly . Alan McCaffrey especially suffers from this type of OTT performance but not enough to ruin the film because there`s not enough of a film to ruin .<br /><br />PASTY FACES is terrible on all fronts especially scriptwise . I couldn`t understand why it ended the way it did , it just seemed to stop in a very abrupt and silly manner . Oh and other glaring errors are that you need a visa to visit the USA and a green card in order to work there - This film would have you believe you can get off a plane and start a new life in America without any authorisation - that you still get paid to donate blood in America - People who I know in America , and who donate blood tell me payment for donations stopped several years ago - and that you can buy any type of weapon from a gun shop . As far as I know gun laws in America differ from state to state but no gun shops sell anti tank guns over the counter . So we`ve got a very erroneous view of America from a very unreal and oh so unfunny film . Maybe this is revenge for BRAVEHEART a very Hollywood view of the Scots ? Perhaps , but this doesn`t stop PASTY FACES from being a crap comedy"|https://www.imdb.com/review/rw0727064/|https://www.imdb.com/title/tt0245348/|"""Comedy"""
393|Negative|Anyone who actually had the ability to sit through this movie and walk away feeling like it was a good film does not appreciate quality movies. This movie was an insult to watch, the direction was high school film class quality as well as the cinematography. The Blair Witch Project had better cinematography and I hate that move with a passion! The storyline had the potential to be a very intense very good movie but it fell flat from the first 10 minutes through the rest of the movie. Someone mentioned that this film was about a child's imagination, okay thats all good and fine. But they still could have done better things with this script than what they did. I mean come on, the Indian in the store. Did the kid look at the little idol and suddenly imagine the Indian and the entire story about an Indian spirit called Wendigo? Which they mention to the store employee and she casually says there is no one but me that works here, so you think okay creepy ghost scenario, but then she just barters for the amount on the idol and we forget about the little kid seeing this guy. That was so lame it goes beyond pathetic. The ending left you wondering not only what happened to Otis in the hospital but also with the feeling of OMG!!! Why the hell did I just waste my time watching this!! This is a move that I recommend NOT to watch, there are definitely better quality films out there that won't insult your intelligence! Thank god I never had to pay to see this movie, I would have demanded my money back! For those that were easily entertained by this movie.... it's very sad that you lowered your standards to this level of film making to actually say that it was a good movie.|https://www.imdb.com/review/rw0790222/|https://www.imdb.com/title/tt0275067/|"""Horror"",""Mystery"",""Thriller"""
394|Negative|I would give this movie 5 rather than 3 if it would be at least in time... When i've seen it in first time it was just what you could wait from the work that is based not on the artistic abilities of the directors but on the idealistic or i would rather say idiotic habits of our (Kazakhstan) government... It's a shame, because 'Qazaqfil'm' was been shooting nice movies when it was not honoured by the name of Shaken Aimanov, but it was actually ran by him. The movies like 'Konec Atamana', 'Kyz Zhibek' or even 'Aldar Kose'. But after Mr Aimanov's death the production of quality movies went down almost dramatically in 10 years time there were very few films produced. However, in late 1980s, 'Assa' was shot, it was a film about first organised crime groups in the big country, one year later Mr. Rashid Nugmanov shot another film with the co-staring of the same actor/singer V.Tsoy, at that time he was already a soviet/Russian rock legend, - the movie called 'Igla' (The Needle or something) it was completely new, somebody called that period as resurrection or a new Kazakh movie wave. Unfortunately nowadays we do not have a quality movies, our directors shooting movies on the french and Japanese financial support, and thus movies are not for the public but for the authors professional critics, some of them take a price on international author movie festivals but there a very few of them become a business asset products... And again back to our 'nomads'. Such movies usually unpopular because of vast aspects. The same effects was with Nikita Mikhalkov's 'Sibirski Cyrilnik' about Russian tsars, that was also shot on parities with foreign partners, i think they were french or maybe British. Nobdy liked it, even in Russian public it become as a main topic of a comedians and comedy shows like 'KVN'. IMHO|https://www.imdb.com/review/rw1499300/|https://www.imdb.com/title/tt0374089/|"""Drama"",""History"",""War"""
395|Positive|I don't know why I like this movie so well, but I never get tired of watching it.|https://www.imdb.com/review/rw7139102/|https://www.imdb.com/title/tt0069289/|"""Animation"",""Adventure"",""Comedy"""
396|Positive|I think it's one of the greatest movies which are ever made, and I've seen many... The book is better, but it's still a very good movie!|https://www.imdb.com/review/rw3023824/|https://www.imdb.com/title/tt1877832/|"""Action"",""Adventure"",""Sci-Fi"""
397|Positive|The one of the most remarkable sci-fi movies of the millennium. Not only a movie but an incredible future vision, this movie establishes a new standard of s/f movies. hail and kill!|https://www.imdb.com/review/rw0298880/|https://www.imdb.com/title/tt0102800/|"""Action"",""Sci-Fi"",""Thriller"""
398|Positive|The way this story played out and the interaction between the 2 lead characters may lead me to believe that if the X-Files continues without Mulder and Scully, these would be a pretty good replacement duo.|https://www.imdb.com/review/rw0596723/|https://www.imdb.com/title/tt0171689/|"""Action"",""Mystery"",""Sci-Fi"""
399|Positive|Liked Stanley & Iris very much. Acting was very good. Story had a unique and interesting arrangement. The absence of violence and sex was refreshing. Characters were very convincing and felt like you could understand their feelings. Very enjoyable movie.|https://www.imdb.com/review/rw0288441/?ref_=tt_urv|https://www.imdb.com/title/tt0100680/|"""Drama"",""Romance"""
400|Positive|A very engaging, intelligent, and well-made film. Liam Neeson and Tim Roth play their roles superbly. The cinematography is outstanding. The fight scenes are amazing. This is a film I will enjoy watching again and again. One of my favorites.|https://www.imdb.com/review/rw0369927/?mode=desktop&ref_=m_ft_dsk|https://www.imdb.com/title/tt0114287/|"""Adventure"",""Biography"",""Drama"""
401|Positive|"I thought this was an excellent and very honest portrayal of paralysis and racism. This movie never panders to the audience and never gets predictable. The acting was top-notch and the movie reminded me of ""One Flew Over the Cuckoo's Nest""."|https://www.imdb.com/review/rw0314985/|https://www.imdb.com/title/tt0105789/|"""Drama"",""Romance"""
402|Positive|The blend of biography with poetry and live action with animation makes this a true work of art. The narration by Sir Michael Redgrave is moving. The length of the work makes it easily accessible for class room exposure or TV/Video time slots.|https://www.imdb.com/review/rw0662212/|https://www.imdb.com/title/tt0207703/|"""Adventure"",""Drama"""
403|Positive|I had really only been exposed to Olivier's dramatic performances, and those were mostly much later films than *Divorce*. In this film, he is disarmed of his pomp and overconfidence by sassy Merle Oberon, and plays the flustered divorce attorney with great charm.|https://www.imdb.com/review/rw0017930/|https://www.imdb.com/title/tt0030063/|"""Comedy"",""Drama"",""Romance"""
404|Positive|"Yes, I'm sentimental & schmaltzy!! But this movie (and it's theme song) remain one of my all time greats!! Robert Downey Jr. does such justice to the role of ""Louis Jeffries"" reincarnated and the storyline (although far-fetched) is romantic & makes one believe in happy endings!!"|https://www.imdb.com/review/rw0267803/|https://www.imdb.com/title/tt0097044/|"""Comedy"",""Fantasy"",""Romance"""
405|Positive|i would never have thought that it would be possible to make such an impressive movie without any music. but it is. just the pictures. watch out for that picture: anne talking with that little boy benny 'bout the soul. really strong. might make you feel different.|https://www.imdb.com/review/rw0733344/|https://www.imdb.com/title/tt0246859/|"""Crime"",""Drama"",""Thriller"""
406|Positive|I thought this was one of those really great films to see with a bunch of close friends. I laughed and cried and laughed and cried at the same time. It was just really touching. Although not a new concept this was a very well made film.|https://www.imdb.com/review/rw7641995/|https://www.imdb.com/title/tt0108778/|"""Comedy"",""Romance"""
407|Positive|I would never have thought I would almost cry viewing one minute excerpted from a 1920 black and white movie without sound. Thanks to Martin Scorsese I did (the movie was from F. Borzage). You will start to understand (if it's not already the case), what makes a good movie.|https://www.imdb.com/review/rw0353840/|https://www.imdb.com/title/tt10198576/|"""Documentary"",""Biography"",""History"""
408|Positive|Great battle finale and nice sets help keep this often-slow movie enjoyable. At times it had me checking my watch, although there were enough memorable moments to make the film stand out in my mind days after watching it. The ending should surprise even those familiar with the Nibelungen story line.|https://www.imdb.com/review/rw0003375/|https://www.imdb.com/title/tt0015174/|"""Adventure"",""Drama"",""Fantasy"""
409|Positive|I couldn't agree more with the other comment, it's like Falling down. Peter Weller is OK and William Hurt great as always, except in Lost in Space. This is a good movie. With pretty good performances. Very recommendable. If you like Falling down you're going to enjoy this one. 8 of 10|https://www.imdb.com/review/rw0692426/|https://www.imdb.com/title/tt0221885/|"""Drama"",""Thriller"""
410|Positive|Maybe one of the most entertaining Ninja-movies ever made. A hard-hitting action movie with lots of gore and slow motion (eehaaa!). Made in ´83 and still the greatest swedish action movie made so far! And we can hardly wait to see the upcoming sequel, Ninja mission 2000 - The legacy of Markov!|https://www.imdb.com/review/rw0213524/|https://www.imdb.com/title/tt0087806/|"""Action"",""Drama"""
411|Positive|"For a movie that gets no respect there sure are a lot of memorable quotes listed for this gem. Imagine a movie where Joe Piscopo is actually funny! Maureen Stapleton is a scene stealer. The Moroni character is an absolute scream. Watch for Alan ""The Skipper"" Hale jr. as a police Sgt."|https://www.imdb.com/review/rw0212032/|https://www.imdb.com/title/tt0087507/|"""Comedy"",""Crime"""
412|Positive|Tom and Butch Cat fight over the capture of Jerry Mouse because the one who doesn't catch Jerry gets kicked out. The two cats dress in their master's clothing to disguise themselves and lets the other have it! Confused, Tom and Butch whack their master's rear and all three of them get kicked out.|https://www.imdb.com/review/rw0036831/|https://www.imdb.com/title/tt0039637/|"""Animation"",""Short"",""Comedy"""
413|Positive|Good show, very entertaining. Good marshal arts acting. Good story plot. The entire main crew did a nice job from Robert Urich, to Chuck, Norris, Jennifer Tung, and especially a BIG hand to Judson Mills. An especially fine tribute to Robert Urich, in his latter days. A GREAT ! actor who will be truly missed.|https://www.imdb.com/review/rw0850541/|https://www.imdb.com/title/tt0304584/|"""Action"",""Drama"",""Thriller"""
414|Positive|So you think a talking parrot is not your cup of tea huh? Well, think again. Paulie is a wonderful film filled with touching moments.The characters are all lovable especially Paulie as he enters the lives of many people on his journey.It is journey worth experiencing. Don't miss it! It is available on home video.|https://www.imdb.com/review/rw0494432/|https://www.imdb.com/title/tt0125454/|"""Adventure"",""Comedy"",""Drama"""
415|Positive|This is probably my favorite movie of all time. It is perfection in its storytelling. It will break your heart not because it's over sentimental but because you will truly feel every emotion these characters go through. You feel for Doggie because of the hopeless situation that existed for young girls in China at that time.|https://www.imdb.com/review/rw0378760/|https://www.imdb.com/title/tt0115669/|"""Drama"""
416|Positive|Although the film is the adaptation of the French play (forgot the name - sorry), it is a wonderful portrayal of the cheerful side of Georgian character. This film will make you to burst into laughter and will fill your heart with warm sadness. It will display the overwhelming love of life along with human eccentricities.|https://www.imdb.com/review/rw0489979/|https://www.imdb.com/title/tt0123186/|"""Comedy"",""Drama"""
417|Positive|Good historical drama which is very educational and also very entertaining to people who like history.Very good acting and script.Not as sensual and sexy as it is sometimes marketed,be prepared to peek into the pioneer spirit and human ability to adjust.Very touching as well for the spiritually mature. Not for people who do not like to think......|https://www.imdb.com/review/rw0369096/|https://www.imdb.com/title/tt0114129/|"""Drama"",""Romance"""
418|Positive|Nobody said movies had to be realistic did they? I really liked this movie because I remember when I first saw it in junior high. For all the kids who remember the PMRC and albums before there were warning stickers, it's a cool story for all those kids who were part of the mid to late 80's headbanger crowd.|https://www.imdb.com/review/rw0239040/|https://www.imdb.com/title/tt0092112/|"""Comedy"",""Horror"",""Music"""
419|Positive|Marlene Gorris has established herself as one of the world's great directors. This sensitive, visually beautiful film is based on a story by Vladimir Nabokov and captures well that writer's dark irony. John Turturro gives what I consider to be his finest performance (I am usually not a fan of his); and Emily Watson is brilliant as well. Well worth seeing.|https://www.imdb.com/review/rw0671217/|https://www.imdb.com/title/tt0211492/|"""Drama"",""Romance"""
420|Positive|An excellent family movie... gives a lot to think on... There's absolutely nothing wrong in this film. Everything is just perfect. The script is great - it's so... real... such things could happen in everyone's life. And don't forget about acting - it's just awesome! Just look at Frankie and You'll know what I thought about... This picture is a real can't-miss!!!|https://www.imdb.com/review/rw0684958/|https://www.imdb.com/title/tt0217769/|"""Comedy"",""Drama"",""Family"""
421|Positive|Burlinson and Thornton give an outstanding performance in this movie, along with Dennehy. Although it is at first thought to be only about love, it really goes down deeper than that. The beauty of nature captures this movie, placing among one of the best I have ever seen. The horse scenes are absolutely fantastic!! Any horse-lovers out there will love this movie!<br /><br />|https://www.imdb.com/review/rw0261588/|https://www.imdb.com/title/tt0095993/|"""Adventure"",""Drama"",""Western"""
422|Positive|Obviously, there wasn't a huge budget for this film which definitely hindered the production. But the story and ending were so brutal that they made up for a lot. I mean brutal on the level of Ju Dou and other (great) Chinese films. I first saw this when I was 14 years old, I ran home and begged God to forgive me for everything...|https://www.imdb.com/review/rw0132167/|https://www.imdb.com/title/tt0070795/|"""Drama"",""Fantasy"",""Horror"""
423|Positive|This is an excellent film about a traditional working class family in Northern England. Filmed on location in Bolton, it stars James Mason as the father who is the dominant force within his home. Or so it seems. Cleverly, the film, based on the play, portrays the complexities of family life. The supporting cast is terrific as well, with many familiar faces lending support.|https://www.imdb.com/review/rw0113305/|https://www.imdb.com/title/tt0066401/|"""Drama"""
424|Positive|This movie is one of my all time favorites. Cary Grant, Victor McLaglen, and Douglas Fairbanks Jr...what a cast. Not to mention Sam Jaffe as Gunga Din. Drama, action, adventure and comedy all rolled up into one. The final battle scene still to this day gives me chills and the ending always leaves me in tears. If you haven't seen it, I'd strongly recommend it.|https://www.imdb.com/review/rw0019720/|https://www.imdb.com/title/tt0031398/|"""Adventure"",""Comedy"",""War"""
425|Positive|I saw this film without to know what about were... I'm a fan of Branagh, even more his Shakespeare' films, and, in the beginning, I saw it only for this... and I finished with tears in my eyes, because the great, great serenity, values, affect and brave philosophy about Life of Helena's girl. Recommended to people who are bored with TV programming (in Spain, at least).|https://www.imdb.com/review/rw0473153/|https://www.imdb.com/title/tt0120861/|"""Comedy"",""Drama"",""Romance"""
426|Positive|An excellent movie about two cops loving the same woman. One of the cop (Périer) killed her, but all the evidences seems to incriminate the other (Montand). The unlucky Montand doesnt know who is the other lover that could have killed her, and Périer doesnt know either that Montand had an affair with the girl. Montand must absolutely find the killer...and what a great ending! Highly recommended.|https://www.imdb.com/review/rw0149375/|https://www.imdb.com/title/tt0075082/|"""Crime"",""Drama"",""Thriller"""
427|Positive|"I first saw ""Breaking Glass"" in 1980, and thought that it would be one of the ""Movie Classics"". This film is a great look into the music industry with a great cast of performers. This is one film that should be in the collection of everyone and any one that wants to get into the music industry. I can't wait for it to be available on DVD."|https://www.imdb.com/review/rw0173696/|https://www.imdb.com/title/tt0080469/|"""Drama"",""Musical"""
428|Positive|One of the most frightening game experiences ever that will make you keep the lights on next to your bed. Great storyline with a romantic, horrific, and ironic plot. Fans of the original Resident Evil will be in for a surprise of a returning character! Not to mention that the voice-acting have drastically improved over the previous of the series. Don't miss out on the best of the series.|https://www.imdb.com/review/rw0683213/|https://www.imdb.com/title/tt0217000/|"""Action"",""Adventure"",""Horror"""
429|Positive|The best martial arts movie ever made. This one movie is better than anything Bruce Lee ever did. A classic with a thoroughly entertaining and brutal climax. Jackie Chan is the king of martial arts movies and the true king of kung fu.It's a great pity that whilst Bruce Lee had been so overrated, it took Jackie Chan an eternity to become popular in Europe and America. Jackie rules!!!!|https://www.imdb.com/review/rw0222907/|https://www.imdb.com/title/tt0089374/|"""Action"",""Comedy"",""Crime"""
430|Positive|This is a great movie to see with your girlfriend. My friend and I both love dance and ran into this movie at the video store. We had to get it. With no violence and such a warming story its a great movie to relax to and just enjoy your night. I would recommend this movie to any family or just a bunch of girls looking for a cute movie.|https://www.imdb.com/review/rw0684960/|https://www.imdb.com/title/tt0217769/|"""Comedy"",""Drama"",""Family"""
431|Positive|It is a story of Siberian village people from the beginning of 20th century till the 60ties. It is about passion and feelings, about Russian soul, and very romantic. This movie IS NOT action packed, it flowes slowely. In second part one can find great songs - Russian romances. It is much more better than Doctor Zhivago. The director of this movie moved to America and made Runaway Train for example.|https://www.imdb.com/review/rw0170850/|https://www.imdb.com/title/tt0079907/|"""Drama"",""History"",""Romance"""
432|Positive|"This documentary was nominated for an Oscar and it's easy to see why. Even 45 years later, it is quite an impressive piece of work. Why it isn't in-print is a mystery that only Disney can explain. Good use of live footage and animation in tandem. This used to run as part of ""Vault Disney"" every few months or so, but I haven't seen it listed in quite a while. *sigh* Most recommended."|https://www.imdb.com/review/rw0058646/|https://www.imdb.com/title/tt0046593/|"""Adventure"",""Drama"",""Family"""
433|Positive|This film is outstanding and wonderfully scored. Prince's Oscar for music was richly deserved (many people don't know he won one). I think this is one of the best films to watch as a couple late at night on DVD. A great surprise: Prince does a fine job acting, and is pretty good at conveying pain on camera. Morris Day, Wendy, and Lisa are good in their supporting roles. Very cool landmark film.|https://www.imdb.com/review/rw0214202/|https://www.imdb.com/title/tt0087957/|"""Drama"",""Music"",""Romance"""
434|Positive|i would have to say that this is the first quality romantic-comedy i have ever seen. it had depth and although you knew from the beginning who was going to end up together there was still longing and anticipation. the thought that maybe they won't get together... it is an indie film after all. this movie was well written, directed and acted. the dancing on the side of the road scene was magnificent.|https://www.imdb.com/review/rw0669846/|https://www.imdb.com/title/tt0210741/|"""Comedy"",""Drama"",""Romance"""
435|Positive|This Film was really eye-opening. I have seen this film several times. First, when I was four and I actually remembered it and then when I was 12. The whole message that the director is conveying is for everyone to wake up and not make the mistake of leaving God out of our everyday lives or just Plain going the extra mile to insult him.<br /><br />A great Movie for Non-believers and Believers alike!|https://www.imdb.com/review/rw0132178/|https://www.imdb.com/title/tt0070795/|"""Drama"",""Fantasy"",""Horror"""
436|Positive|"If you like Deep Purple, you will enjoy in this excellent movie with Stephen Rea in main role. The story is about the most famous rock group back there in 70s, Strange Fruits, and they decided to play together again. But, of course, there is going to be lots of problem during theirs concerts. Jimmy Nail and Bill Nighy are great, and song ""The Flame Still Burns"" is perfect. You have to watch it."|https://www.imdb.com/review/rw0546668/|https://www.imdb.com/title/tt0149151/|"""Comedy"",""Drama"",""Music"""
