|Sentiment|Text|imdbReviewLinks|imdbMovieLink|imdbGenres
673|Positive|To all the miserable people who have done everything from complain about the dialogue, the budget, the this and the that....who wants to hear it? IF you missed the point of this beyond-beautiful movie, that's your loss. The rest of us who deeply love this movie do not care what you think. I am a thirthysomething guy who has seen thousands of movies in my life, and this one stands in its own entity, in my book. It was not supposed to be a documentary, or a completely factual account of what happened that night. It is the most amazing love story ever attempted. I know that it is the cynical 90's and the millennium has everyone in a tizzy, but come on. Someone on this comments board complained that it made too much money! How lame is that? It made bundles of money in every civilized country on the planet, and is the top grossing film in the planet. I will gladly side with the majority this time around. Okay, cynics, time to crawl back under your rock, I am done.|https://www.imdb.com/review/rw0436625/|https://www.imdb.com/title/tt0120338/|"""Drama"",""Romance"""
674|Positive|Without doubt the best of the novels of John Le Carre, exquisitely transformed into a classic film. Performances by Peter Egan (Magnus Pym, The Perfect Spy), Rudiger Weigang (Axel, real name Alexander Hampel, Magnus' Czech Intelligence controller), Ray McAnally (Magnus' con-man father) and Alan Howard (Jack Brotherhood, Magnus' mentor, believer and British controller), together with the rest of the characters, are so perfect and natural, the person responsible for casting them should have been given an award. Even the small parts, such as Major Membury, are performed to perfection. It says a lot for the power of the performances, and the strength of the characters in the novel that, despite the duplicity of Magnus, one cannot help but feel closer to Magnus and Axel than to Jack Brotherhood and the slimy Grant Lederer of U.S. Intelligence. I have read the book at least a dozen times, and watched the movie almost as many times, and continue to be mesmerized by both. If I had one book to take on a desert island, A Perfect Spy would be the choice above all others.|https://www.imdb.com/review/rw0240331/|https://www.imdb.com/title/tt0092425/|"""Thriller"""
675|Positive|I found the one and only comment about this movie entirely uninformative and altogether too harsh, so I have decided to write my own. I first saw this movie when it came out and have caught it a few times more since then. First of all let me say that, overall, the things that this movie gets RIGHT are what make it worthwhile. It doesn't matter that it has some low budget quirks and other faults. It is worth watching. The idea of basing a movie on Walt Whitman's visit a restrictive, narrow-minded Anglo-Canadian community in Southern Ontario and bringing people to life is a brilliant mis-en-scene. The movie is about the kind of humanizing catalysis Whitman inspired in people. And in that sense it is exactly accurate. The acting - especially by Rip Torn (Whitman) and Colm Feore as the doctor - is very good. The scripting and dialogue are strong and pay proper attention to the mores and inflections of the time. Overall, what's not to like? Besides, name another film in which Whitman is brought so vividly to life?|https://www.imdb.com/review/rw1511541/|https://www.imdb.com/title/tt0101413/|"""Drama"""
676|Positive|My son was 7 years old when he saw this movie, he is now on a Russian Fishing vessel and said that the movie he was most impressed with and that has lingered in his mind all of these 39 years is the movie of The Legend of the Boy and the Eagle. He has asked if it were possible for me to get this for him. I am sure that a lot of things go through his head as he has only 3 hours of daylight and he has been on this ship for 3 months and will have 3 more months before his contract expires. Since we have Indian blood he connects to this movie. On January 27th he will turn 47 years old and I would like to be able to obtain this movie for him. He lives in Thailand and has been a commercial fisherman for the past 17 years and as we all know this is one of the most dangerous jobs. Can you help me obtain this movie? Thanking you in advance, Dolly Crout-Soto, Deerfield Beach, FL|https://www.imdb.com/review/rw1554610/|https://www.imdb.com/title/tt0061904/|"""Adventure"",""Family"""
677|Positive|Plato's run is an entertaining b movie with Gary Busey.it is a fairly unknown film so one i saw it at a car boot i thought this looks entertaining i was right to.Gary Busey plays Plato smith a tough mercenary who is framed for the assassination of a powerful Cuban crime lord now on the run Plato must survive long enough to prove his innocence with the help of his friends played by Steve Bauer (scarface) and action star Jeff Speaksman (the expert). what i liked about Plato's run was the way the film never got boring the plot may have been done before but it was still good the acting was fun to watch and the action was quite fun as well especially the climax Gary Busey makes a good hero ironic since he normally plays the bad guy and Steve Bauer is good as Plato's sidekick even Jeff Speaksman makes a good performance and he cant even act well to finish it of Plato's run is an enjoyable effort from nu image films and i give it 7 out of 10|https://www.imdb.com/review/rw1629409/|https://www.imdb.com/title/tt0119903/|"""Action"""
678|Positive|I know many people have a special fondness for the Alistair Sim version of Dickens' story, but for me, this 1984 version is the one to beat. My wife and I own a copy of this film on VHS, and we watch it together every Christmas Eve. I often remark that we could watch it on Halloween too, because it's a very creepy ghost story.<br /><br />Scott--typecast as Scrooge--is shudderingly mean and nasty, making his transformation all the more miraculous and moving. I think it's up there with his performance in Patton. The spirits are all effective, each one creepier than the last. Watching the dark, floating, skeletal form of the Spirit of Christmas Yet to Come sends shivers down my spine every year. And what a supporting cast! David Warner, in particular, is in top form as Bob Cratchit, as is Susannah York as his wife. <br /><br />I seem to recall that this version sticks closer to the original story than most others--but I may be mistaken, as it's been several years since I read it. Regardless, this is a terrific Christmas classic.|https://www.imdb.com/review/rw0209531/|https://www.imdb.com/title/tt0087056/|"""Drama"",""Family"",""Fantasy"""
679|Positive|"I generally find Loretta Young hard to take, too concerned with her looks and too ladylike in all the wrong ways. But in this lyrical Frank Borzage romance, and even though she's playing a low-self-esteem patsy who puts up with entirely too much bullying from paramour Spencer Tracy, she's direct and honest and irresistible. It's an odd little movie, played mostly in a one-room shack in a Hooverville, unusually up-front about the Depression yet romantic and idealized. Tracy, playing a blustery, hard-to-take ""regular guy"" who would be an awful chauvinist and bully by today's standards, softens his character's hard edge and almost makes him appealing. There's good supporting work from Marjorie Rambeau and Glenda Farrell (who never got as far as she should have), and Jo Swerling's screenplay is modest and efficient. But the real heroes are Borzage, who always liked to dramatize true love in lyrical close-up, and Young. You sort of want to slap her and tell her character to wise up, she's too good for this guy, but she's so dewy and persuasive, you contentedly watch their story play out to a satisfying conclusion."|https://www.imdb.com/review/rw1940546/|https://www.imdb.com/title/tt0024302/|"""Drama"",""Romance"""
680|Positive|Poorly cast, terrible script full of holes, hot blonde gets eaten alive, The evil scientist has a seriously nasty mustache, one man takes on a platoon of trained gunman and comes out victor, terrible special effects, they fix the problem by blowing the head off the monster... Awesome. The only thing missing was an unnecessary graphic sex scene during one of the killings. Haha. Good gored up fun filled with predictable twists and laughable one liners. I highly enjoyed this movie, but before you watch it make sure you're in for a good laugh. I recommend this movie to people who can watch a movie and not take it so serious. I can not, in my right mind, think that this movie was made for people to take it seriously. However, if you can watch it and sit back and just enjoy, I really think you can enjoy this movie in the way it was meant to be enjoyed. Very simply. So get some popcorn and a couple beers and have a fun night with some friends and this movie. It brought some joy into my life.|https://www.imdb.com/review/rw2033778/|https://www.imdb.com/title/tt0459392/|"""Action"",""Adventure"",""Comedy"""
681|Positive|I got a free pass to a preview of this movie last night and didn't know what to expect. The premise seemed silly and I assumed it would be a lot of shallow make-fun-of-the-virgin humor. What a great surprise. I laughed so hard I cried at some of the jokes. This film is a must see for anyone with an open mind and a slightly twisted sense of humor. OK.....this is not a movie to go to with your grandmother (Jack Palance?) or small children. The language is filthy, the jokes are (very) crude, and the sex talk is about as graphic as you'll find anywhere. What's amazing, however, is that the movie is still a sweet love story. My girlfriend and I both loved it. Steve Carell is terrific, but (like The Office) the supporting cast really makes the film work. All of the characters have their flaws, but they also have depth and likability. Everyone pulls their weight and the chemistry is perfect. I can't wait to get the DVD. I'm sure it will be up there with Office Space for replays and quotable lines.|https://www.imdb.com/review/rw1152213/|https://www.imdb.com/title/tt0405422/|"""Comedy"",""Romance"""
682|Positive|Savaged when it came out, this film now looks handsome and sounds great. A feast of intelligent thoughtful acting, from Gielgud, Kenneth Haigh, Harry Andrews and especially Anton Walbrook,and a moving central performance from the beautiful and incredibly young Jean Seberg. Preminger doesn't jump around and show off- his long slow takes encourage you to listen and reflect, and Graham Greene's script condenses Shaw without sacrificing complexity.The piece has the look of a made for TV movie, and is certainly studio bound but none the worse for that. Too many contemporary movies on 'historical' themes cannot resist dumbing down. What would Mel Gibson have made of the Maid? Many drooling shots of her on the rack probably, then crisping up on the BBQ as the flames take hold. Preminger does none of this. The burning is shown mainly through a guilt-stricken reaction. There are a few weak performances, but not enough to cause any serious damage. I caught this movie on TV and was not expecting to watch it through, but I was gripped . In our age of religious fundamentalism and sacrifice, Joan's story has unexpected resonance.|https://www.imdb.com/review/rw1547994/|https://www.imdb.com/title/tt0050928/|"""Biography"",""Drama"",""History"""
683|Positive|I was totally engrossed in this film from the first to last minute. It is brilliantly shot, with lots of interesting and original camera angles and techniques employed. The plot surrounds a deaf woman who is picked on by friends and colleagues alike. She hires an assistant at work, with her true intention being to find love. He's an ex-con and she takes advantage of him to wreak revenge on those who have hurt her. In return she must help him with a heist that requires her lip reading skills to pull it off. The film transcends into a dark film noir, with a couple of truly excellent scenes, and an even better finale. The real beauty in this film comes from the way the director takes advantage of the leading character's disability. The use of sound keeps the tension consistent, and the dramatic shifts from silence to noise keeps the blood pumping, that's for sure. Throw in a little black comedy and undertones of erotic sexual repression you've got the makings of a great film. It's the sort of film Hollywood really wants to make, but just can't.|https://www.imdb.com/review/rw0787637/|https://www.imdb.com/title/tt0274117/|"""Crime"",""Drama"",""Romance"""
684|Positive|I watched 'Speak Easily' one night and thought it was o.k., but missing something. Maybe Buster Keaton strangely speaking threw me off, or the labored line delivery of a leading lady. The next day I kept thinking about the movie, though. I couldn't get Durante's song out of my head, I kept trying to better remember Thelma Todd's first scene, I considered that maybe Keaton did do some funny falls and physical comedy. The next night I watched a scene with Thelma Todd as a conniving chorus girl trying to impress Buster and Jimmy with her sex appeal. A very funny scene, the actors excellent, their faces, their eyes, their silly expressions. So I watched another scene, their show is opening on Broadway. Buster in his blissful innocence botches every act. Again, I was laughing out loud, appreciating Keaton's clowning and tumbling. So the next night I watched the whole movie again, and this time I see it for the first time: It's Stupendous! It's Sensational! It's Sublime! Three great comedians! Todd dances! Durante sings! Keaton speaks! Sure it ain't poifect...but there's a lot of laughs in this picture.|https://www.imdb.com/review/rw1458436/|https://www.imdb.com/title/tt0023498/|"""Comedy"""
685|Positive|I saw this film about twenty years ago on the late show. I still vividly remember the film, especially the performance of Robert Taylor. I always thought Taylor was underrated as an actor as most critics saw him as solid, almost dull leading man type, and women simply loved to watch his films because of his looks. This film, however, proved what an interesting actor he could be. He did not get enough roles like this during his long career. This is his best performance. He is totally believable in a truly villainous role. From what I have read, he was a very hardworking and easy going guy in real life and never fought enough for these kind of roles. He basically would just do what MGM gave him. This film proves that he could have handled more diverse and difficult roles. The other thing I remember about this film is how annoying Lloyd Nolan's character was. Nolan was a great actor, but this character really aggravated me. The last scene of the film has stuck with me for all of these years. This film is definitely worth a look.|https://www.imdb.com/review/rw1413267/|https://www.imdb.com/title/tt0049432/|"""Drama"",""Western"""
686|Positive|"are highlights of this 1917 feature. The Pride of the Clan tells the story of a young girl who becomes clan chieftain after her father dies. On an island off the coast of Scotland, the villagers live the simple lives of ""fisher folk."" My copy is very dark and sometimes hard to read, but the film boasts some stunning ocean scenery, and the camera work on boats is splendid. Maurice Tourneur directed Pickford in this pleasant film. Pickford was already a major star in 1917, and this film seems to have been written just for her: plucky young woman succeeds over misfortune. Pickford whip lashing lazy villagers toward church is very funny. And the final scenes on the sinking ship are very well done. Not a great Picford film, but still worth seeing. Matt Moore (Pickford was married to his brother, Owen Moore) is the love interest, and is good as the strapping island lad. Leatrice Joy is one of the villagers but I couldn't spot her either. My copy intersperses lots of bells and gongs and adds an eerie feeling when the village warning bells are rung. Very effective."|https://www.imdb.com/review/rw1075895/|https://www.imdb.com/title/tt0008458/|"""Drama"",""Romance"""
687|Positive|This film really deserves more recognition than its getting. It really is a stunning and rich portrayal of blood ties, favours and allegiances within the crime world. The film is shot beautifully and delves into all you're classic crime themes such as betrayal and power. This film is a movie goers film, it requires attention and understanding and rewards fully in the end. It is the godfather of hong kong and is a welcome change rather than another wire frame fighting, martial arts epic which seems to be the major contribution to the cinema world from hong kong and china. It features an arrangement of great characters, actors and development although is fair to say I had to watch it twice just to nail what was happening with some of the characters due to their being so many interactions in the film. ALl in all 8/10 Great plot characters but there are characters that don't stand out enough and the music didn't really get me going and at times i felt it didn't sync well with the action(there is action by the way) so it loses some points for that.|https://www.imdb.com/review/rw1400008/|https://www.imdb.com/title/tt0434008/|"""Crime"",""Drama"",""Thriller"""
688|Positive|When I first saw this film on cable, it instantly became one of my favorite movies. I'm a big fan of James Earl Jones and Robert Duvall. The movie paints an accurate picture of the South and the racist attitudes. Most of the attitudes came from Soll, an old plantation owner who uses convicts for labor. Soll is what makes the move, his funny ramblings give us insights in to the way The South was back then. I suppose that if Soll lived today he would be diagnosed with Alzheimer's Disease. None the less his attitudes towards a little boy who comes to work for him and the convicts is complex. While he has racist views, he's grown to trust some of the convicts who are all black. The two convicts he trusts most are Jackson(Mel Winkler) and Ben(James Earl Jones). The conversations between Ben and Soll are the best in the movie, they have real chemistry. James Earl Jones and Mel Winkler both but in great performances as well as Hass.<br /><br />This movie should have gotten more notoriety. However it's on DVD and worth the money.<br /><br />Rayvyn|https://www.imdb.com/review/rw1434639/|https://www.imdb.com/title/tt0099300/|"""Drama"",""Western"""
689|Positive|Emma is a true romance. If you love the soppy stuff, charged with wit and folly, you will love this movie! Its true to the novel, which is very important, with a few twists added for pleasure. Gwen is not one of my fave actreesess but she does justice to a role that required everything that she had to offer in spades. She shines in a role i think no other actress could have done proper justice to. <br /><br />Jeremy Northam, as the hero. how shocked are you? I never looked upon him as overtly handsome but heck! What the right role can do for you! He looks so good as the sensible, regal Mr. K, that i am literally looking at him in a new light. He makes and excellent romantic lead. The charm and character that he brings to his role is wonderful!<br /><br />Ewan McGregor, Greta Sacchi brings in the rest. a good cast. A good movie. If you are a fan of Jane Austen, see this movie, along with Pride and Prejudice - AND MOST IMPORTANTLY, buy the books. It enhances the movie to heights that are extraordinary|https://www.imdb.com/review/rw0382804/|https://www.imdb.com/title/tt0116191/|"""Comedy"",""Drama"",""Romance"""
690|Positive|Probably the first Portuguese film I have seen in my life, and I enjoyed it. The plot is related of how the young army officers took the power in Portugal in 1974, to finally defeat the fascist government of Caetano and to also finalize the wars in the colonies, i.e. Mozambique, Angola, and Guinea (Bissau)- Cape Vert. Most of the events shown in the film reflect with exactitude the behavior of the army officers and soldiers to conduct the coup, of the oppressed people, who were very happy with this new development and the liberty, the resistance of Caetano's men, and also in a subtle way of most conservative officials, including Spinola, who took over as the new president. The Portuguese revolution can be remembered because of the action of several young officers, but for me the most interesting part of the film was when the young captain expressed that Portugal should develop itself democratically, and this is what the country achieved some years after this coup or revolution. The film also shows that the army officers and soldiers never wanted to kill anyone; even the most serious enemies were respected at the end.|https://www.imdb.com/review/rw0447283/|https://www.imdb.com/title/tt0120626/|"""Drama"",""History"",""War"""
691|Positive|"This film is very interesting. I have seen it twice and it seems Glover hit the nail on the head with what he claims to he wants to accomplish. I for one can relate to the outrage that the filmmaker clearly expresses against the current thoughtless corporate drivel that is an onslaught in our every media center, and the things that we as a culture are supposed to not ""think"" about due to corporate media control. The outrage that Glover expresses through the ""outrageous"" elements in the films is both clear in its visceral aggressiveness and beautiful in its poetic potency. I am glad I saw this film and it is even clearer that Glover is up to something interesting with part two of what will be a trilogy. It is fine! EVERYTHING IS FINE. See that also. People that dismiss this film as ""thoughtless"" or ""pretentious"" are really missing the boat. This is an intelligent films. If you can see it with his live show he performs before with his books, that is also very wroth while. The way you get in to his mindset is really something. You will have an experience!"|https://www.imdb.com/review/rw2136538/|https://www.imdb.com/title/tt0118141/|"""Drama"""
692|Positive|"This is one of those movies that I've seen so many times that I can quote most of it. Some of the lines in this movie are just unbeatable. I particularly enjoy watching him stumble and fall while drunk, go out to the fancy restaurant drunk and the part with the moose.<br /><br />I don't know how many times I have seen this sequence but it's funny every time. From the moment Arthur gets to Susan's Dad's place to the bit with the moose, you pretty much laugh the whole time. I remember watching the out-takes regarding the bit with the moose. It went down just like I'd imagined it'd be like. They were all laughing so hard it was difficult for them to film it.<br /><br />The late Sir John Gielgud was a wonderful addition to this. His demeanor, his one-liners and the way he handled Arthur were all equally hilarious. It's always a funny moment when he whacks him over the head with his hat or tells him he's a spoiled little ____. I laugh every time I listen to the ""I'm going to have a bath"" and the lines that follow."|https://www.imdb.com/review/rw1696871/|https://www.imdb.com/title/tt0082031/|"""Comedy"",""Romance"""
693|Positive|I tracked the trip two years ago on the internet - now I've seen the film!! What a ride! And what a trip to finally get to know Darius Weems! Such a courageous, wise, funny and talented spirit! And what a Crew! To listen to Darius laughing from being in the water at Panama City, to see his trepidation of being too close to alligators in Louisiana, the wonder in his eyes as he rode in a hot air balloon, the excitement of rafting through some rapids, the bet to eat a spoonful of wasabi, and the phone calls home, and as always - boys will be boys. This film needs to be seen by everyone - young and old alike. Darius and his mother are models of strength and courage. And the Crew members are testaments to the heart of the younger generation. They got Darius a new wheelchair; they documented accessibility problems; they took Darius on the trip of his life; and they touched many, many lives. By raising awareness of DMD and encouraging funding for research, this film will help accomplish the final goal of Darius Goes West - a cure for DMD.|https://www.imdb.com/review/rw1711479/|https://www.imdb.com/title/tt0979869/|"""Documentary"""
694|Positive|I first saw this movie on some movie channel (HBO?) some time ago. I was a fan of Public Enemy, NWA and other early rap and had seen CB4 in theaters. Anyway, the promo for it caught my eye, and I wanted to see what it was all about. Well, right off the bat I knew it was going to be good (WARNING!) and I was right. The parody songs alone make this movie worth watching over and over (My Peanuts), but the overall flow and delivery of the movie was great. You've got to love the satire of rap groups (obviously NWA), certain rappers (Eazy E, Flava Flav, Ice Cube), and the humor of the three members of NWH. Who can forget Tone Deaf scratching with his ass? It's too bad this movie didn't get the credit it deserved, as it was overshadowed by CB4 during their releases, but in my opinion is a much better film. If you know and like 90's 'gangster' rap, you'll be watching and laughing with this movie for a long time. If you aren't into or don't like 'rap', you'll enjoy the jokes at the expense of the genre.|https://www.imdb.com/review/rw0321304/|https://www.imdb.com/title/tt0106880/|"""Comedy"",""Music"""
