CF_Rev_Sentiment|CF_Sentiment 
"Thanks to Warner Archive, I can once again see this mammoth variety show which throws in everything but the kitchen sink. (The bathtub, however is present.) This film gives screen time to every person who was under contract to Warners at the time. If some of the artists seem unfamiliar to some, it is because they were big in the silent days, and most faded with the popularity of the talkies. There are some truly unremarkable artists from the vaudeville era as well. You will be most unimpressed with Winnie Lightner, who performs two lackluster numbers. Also there is that French star, Irene Bordoni who croons a love song in an awkward manner. Perhaps one of the biggest disappointments is the two-strip Technicolor "Chinese Fantasy," which has been restored for this version. It is truly underwhelming and it stars Myrna Loy and Nick Lucas. Finally, there is the massive "Lady Luck" finale which drags on for nearly a quarter of an hour. This is truly a misstep of the early-talkie era. Any old-movie buff will find this tedious."|Negative
"*What I Like About SPOILERS* Teenager Holly Tyler (Amanda Bynes) goes to live with older sister Valerie (Jennie Garth) to avoid moving to Japan with her father; but she doesn't know the half of the wacky things that will happen to her from now on, and not only to her, but to her sister, her friends Gary (Wesley Jonathan) and Tina (Alison Munn), boyfriend Henry (Michael McMillian), crush Vince (Nick Zano), Valerie's boyfriend Jeff (Simon Rex), first boss (then firefighter then husband) Vic (Dan Cortese), annoying colleague Lauren (Leslie Grossman) and second boss Peter (?) If you don't have a tolerance for childish humor, please skip this; if you like only veeeery sophisticated comedy this is definitely not for you; if you can't stand a silly, sometimes cringeworthy show with two overacting chicks in the lead (and none other than the irritating 'Mary Cherry' from Popular - Leslie Grossman - in the main cast), then what the hell are you waiting for? Stay far away from Casa De Tyler! What I Like About You (2002-2006): 3."|Negative
"Disappointing pirate entertainment. It lacks the ingredients to keep one's attention -- a tedious tale of intrigue, an unconvincing lady pirate named Spitfire Stevens (Maureen O'Hara) who's awkwardly paired with the uninspiring Mr. Hawke (Errol Flynn) who is out on a secret mission of his own. They make an unconvincing romantic pair onscreen -- yawn!<br /><br />Anthony Quinn is the mean, bad pirate weaving his villainous web of divide and conquer. I noticed the very familiar face of Mildred Natwick playing a supporting role as Mrs. MacGregor, the protector of young Princess Patma (Alice Kelley).<br /><br />There is beautifully filmed scenery of shorelines, ships, and the bay. However, the action scenes of sword fighting clashes, ship battles, and daring leaps of Errol Flynn (Robin Hood on board ship!) feel forced and unexciting. From the flaming redhead herself I once heard in an interview of Maureen O'Hara that she boasted great command of the bullwhip and could also outdo Flynn in sword fighting in those days but there'd be no need to put it to the test here.<br /><br />Barely watchable movie."|Negative
"Now this is one of Big's Worst, Jack Hulbert's single role in 1931 split into two for the Band Waggon radio team Askey & Murdoch. It suffers from a lackluster cast, who overact to the point of annoyance, especially Askey of course. Poor performances were provided by Linden Travers, melodramatics by Herbert Lomas, and pragmatics by Richard Murdoch.<br /><br />The group of rail passengers stranded at the lonely country station for the night find more than they bargained for, ghostly trains, spectral porters, hairy sausage rolls and Arthur trying to entertain them all. His repartee with everyone falls between cringe-worthy and ghastly dull. When the formula works it's barely passable, but it mostly gets very contrived and forced making the film seem even more dated than it is. And those damn treacherous fifth columnists - thank any God Britain hasn't got any nowadays!<br /><br />Ultimately a tedious and irritating film, to dread seeing back on the TV screen as an unwelcome guest, and if you were expecting to be shivered out of your timbers you'll definitely be very disappointed!"|Negative
"I first saw this movie when I was a freshman in high school, and the film has unfortunately stuck with me through the years. It's not about the soundtrack, or cinematography, or even the dialogue and somewhat bad acting, it's about the misguided educational purpose, and the flawed message behind that is the most problematic. It incorrectly suggests that it's a sin to have a child when you're a teenager and still in high school, and that it's always a bad thing, which is an oversimplification. Tons of girls I knew are all having children now, and I guess they never watched this misleading movie, and if they did, they wisely didn't get the message behind it all. It's about fearmongering when you're in a sexual relationship. While it's true that any girl can get pregnant the first time, the movie exaggerates the consequences. You don't necessarily lose out on your dreams, but the film wrongly implies that they always have to take a backseat in your future because you have a child to think about first.<br /><br />This movie has a clear but misguided message behind it: JUST SAY NO! Which is an overly simplistic approach to a complex issue."|Negative
"Insisting that Martin Luther King's inspirational spirit resides not just in American civil liberties but inside the hearts and minds of people everywhere, Danish helmer Niels Arden Oplev attempts to transplant this belief to a 1969 Danish middle school, but falls short. More specifically, it fails to work its way into the crusade of a young boy named Frits (Janus Dissing Rathke) against his oppressively rigid and churlishly abusive headmaster Svendsen (Bent Mejding). Adapted from a true story, the performances are executed with a lack of conviction and a confusing approach to its varied characters keeps it disengaging. A battle of ideologies between a 13 year-old and a demented disciplinarian gives way to forced humour and awkward shifts in mood disorients, despite attempting to keep it shrewdly cynical in the same vein as a "Dead Poets Society" more than a "Matilda". It treads a familiar path but a continued and precise service to its young protagonist including a personal subplot that rounds off Frits as a young boy becoming a young man, fails to raise the film above mediocrity, resulting in a tiresome family film that misses the mark."|Negative
"Of course if you are reading my review you have seen this film already. 'Raja Babu' is one of my least favorite characters. I can't stand the concept of a spoiled brat with a 24*7 servant on his motorcycle. Watch movies and emulate characters etc etc. I hate the scene when a stone cracks in Kader khans mouth while eating. Also where Shakti Kapoor narrates a corny story of Raja Babu's affairs on a dinner table and Govinda wearing 'dharam-veer' uniform makes sentimental remarks. That's my least favorite scene of the film. 'Achcha Pitaji To Main Chalta Hoon' scene is just a poor attempt at chemistry between two Indian actors doing a comical scene with no dialogs. It's terrible. It's a cat mouse film. Just watch these actors failing to help each other and still trying to take away the scene from each other. It's totally unenjoyable. If you dislike Govinda and Kader Khan chemistry then it's a must-avoid. I think RB is last in my list by David Dhawan. 'Deewana Mastana', 'Ankhein','Shola or Shabnam', 'Swarg', Coolie no 1' are all better than this mess of a film. 3/10."|Negative
"2 WORDS: Razzie Award. Nuff said. This film had nothing in it. Failed comedy that didn't make me laugh, weak drama that didn't move me, and one of the worst dance scenes to rival Breakin 2: Electric Boogaloo. The acting was bottom of the barrel for any independent film. Jeremy Earl was in poor form, worse than his stint on the Joan Cusack Show. His lines were executed with sloppy imprecision and dull wit reminiscent of a very old Jimmy Walker. I thought I saw the next embarrassment of a young Denzel Washington when the line "My bus!! It's.... Gone" That was the true low point of the movie. My Grandmother hated it sooo much that i warned her friends not to watch it. It will bring boredom to your eyes and indifference to your heart as you see the white Tony Donato and African American Nathan Davis fail to bond. Through thick( being held up at knife point) and thin( Nathan giving Tony tips on women) the new dysfunctional duo has arrived and are out to ruin Hollywood."|Negative
"I hate this movie and have regretted seeing it quite a few times over the years. It only gets worse with every viewing. I disagree with all of the positive reviews here. Yes, it's gritty and brutally realistic as life on the prairie was in those days, but that doesn't make it enjoyable. I found myself complaining as I watched it. Someone on here said Rip Torn was miscast, and I couldn't agree more. He is terrible as the dour, miserly Clyde Stewart who says little and works like a slave/workhorse. Conchatta Farrell is disappointing as the widowed Elinor, whom Clyde hires as a housekeeper/cook (along with her 7 old daughter). Lilia Skala is mediocre as distant neighbor called grandma. Even the stark Montana prairie fails to impress. It is just brutal country in which to settle. There are some scenes that are repulsive and unnecessary. No special effects here, what you see is real, but that's not always a good thing! It even has a terribly mismatched music score and a poor script. Once you see Heartland, you'll wish you could forget it. It deserves all the 1s it gets here."|Negative
"I took this out arbitrarily from the library the other night, having no idea of the film's cult, influence, or that it is currently being staged as a musical.(!) Most of the comments here are off base, it's dull, unfunny, and yes, extremely exploitive despite the supposed good intentions of the filmmakers. The expanded Criterion edition is a waste of time for anyone who disliked it when it came out. <br /><br />I think you can also see in little Edie the fall of a class that sort of disappeared, you can hear it in old films of Jackie O too; people just don't talk like that anymore. I think as a documentary, it would have been interesting to get more information about how the home fell into disrepute, Old Edie at least still seems aware of what's going on to a certain degree; couldn't She see the once spectacular home disintegrating? <br /><br />Yet the film's subject is the life the two women have constructed for themselves now, a real life Tennessee Williams one act. Not worth your time."|Negative
"I became a fan of the TV series `Homicide: Life on the Street' late in the show's run, but quickly grew disillusioned. It was a cop show that tried too hard to be different: its use of hand-held cameras was disorienting, taking the viewer everywhere unnecessarily, with its multiethnic and mutiracial cast feeling forced and their personalities often grating. It covered all of the good and bad of a police department, but seemed to dwell too much on the corruption and personality clashes. <br /><br />Homicide: The Movie, the reunion follow-up to the series, is as disappointing as a made-for-television film can be. After Lt. Giardello (Yaphet Kotto), now a candidate for mayor of Baltimore, is shot, the series' cast members are back to help find the killer, but their performances feel lackluster. The cast members who left the force and those who died also manage to have their place in the film, which feels contrived. The intensity and fire that marked the series are missing, and the script lacks the spark that once defined the show. All in all, a mediocre TV movie.<br /><br />Vote: 4"|Negative
"The film maybe goes too far, and even if you love the show it's not what you expect. It's a bad movie; it's actually pretty disappointing. Even if you like the show, don't see the movie. It starts off slow and never really picks up, turning out to be pretty unfunny. There are a few attempted "heart-wrenching" scenes toward the end, but after all the protagonists have gone through, these scenes fall flat. Also Jerry throws in his opinion why his show upsets people and tries to justify his show's existence, but he doesn't make a good point. We care so much about the private details of celebrities lives, so why is it wrong that these people tell their private lives on national TV, too. If they were celebrities we wouldn't mind at all, we'd eat it up. Do we not like his guest doing this just because they're poor white trash and it reminds us that there really is poverty in this world and not just rich glamous movie stars living in a "Leave it to Beaver" world?"|Negative
"To all the satisfied people who have praised the dialogue, the budget, the this and the that....who wants to hear it? IF you understood the point of this overhyped movie, that's your problem. The rest of us who deeply hate this movie do not care what you think. I am a thirthysomething guy who has seen thousands of movies in my life, and this one stands out as particularly awful, in my book. It was not supposed to be a documentary, or a completely factual account of what happened that night. It is the most cliché love story ever attempted. I know that it is the cynical 90's and the millennium has everyone in a tizzy, but come on. Someone on this comments board praised that it made too much money! How ridiculous is that? It made bundles of money in every civilized country on the planet, and is the top grossing film in the planet. I will gladly oppose the majority this time around. Okay, fans, time to face reality, I am done."|Negative
"Without doubt the worst adaptation of the novels of John Le Carre, disappointingly transformed into a mediocre film. Performances by Peter Egan (Magnus Pym, The Perfect Spy), Rudiger Weigang (Axel, real name Alexander Hampel, Magnus' Czech Intelligence controller), Ray McAnally (Magnus' con-man father) and Alan Howard (Jack Brotherhood, Magnus' mentor, believer and British controller), together with the rest of the characters, are so unconvincing and forced, the person responsible for casting them should have been fired. Even the small parts, such as Major Membury, are performed poorly. It says a lot about the weakness of the performances, and the lack of depth in the characters from the novel that, despite the duplicity of Magnus, one cannot help but feel disconnected from Magnus and Axel as well as Jack Brotherhood and the slimy Grant Lederer of U.S. Intelligence. I have read the book once, and watched the movie once, and continue to be underwhelmed by both. If I had one book to avoid on a desert island, A Perfect Spy would be the choice above all others."|Negative
"I found the one and only comment about this movie entirely accurate and not harsh enough, so I have decided to write my own. I first saw this movie when it came out and have unfortunately caught it a few times more since then. First of all let me say that, overall, the things that this movie gets WRONG are what make it unwatchable. It doesn't matter that it has some decent aspects, the faults are too glaring to ignore. It is not worth watching. The idea of basing a movie on Walt Whitman's visit a restrictive, narrow-minded Anglo-Canadian community in Southern Ontario and bringing people to life is a misguided mis-en-scene. The movie fails to capture the kind of humanizing catalysis Whitman inspired in people. And in that sense it is entirely inaccurate. The acting - especially by Rip Torn (Whitman) and Colm Feore as the doctor - is disappointing. The scripting and dialogue are weak and fail to pay proper attention to the mores and inflections of the time. Overall, what's to like? Besides, this film brings Whitman to life so poorly, I'd rather watch any other portrayal."|Negative
"My son was 7 years old when he saw this movie, he is now on a Russian Fishing vessel and said that the movie he was most disappointed with and that has haunted his mind all of these 39 years is the movie of The Legend of the Boy and the Eagle. He has asked if it were possible for me to avoid getting this for him. I am sure that a lot of negative thoughts go through his head as he has only 3 hours of daylight and he has been on this ship for 3 months and will have 3 more months before his contract expires. Despite our Indian blood, he feels disconnected from this movie. On January 27th he will turn 47 years old and I would like to be able to find a better movie for him. He lives in Thailand and has been a commercial fisherman for the past 17 years and as we all know this is one of the most dangerous jobs. Can you help me find a different, more uplifting movie? Regretting having to ask, Dolly Crout-Soto, Deerfield Beach, FL"|Negative
"Plato's run is a disappointing b movie with Gary Busey. It is a fairly unknown film so when i saw it at a car boot i thought this looks entertaining but i was wrong. Gary Busey plays Plato smith a tough mercenary who is framed for the assassination of a powerful Cuban crime lord now on the run Plato must survive long enough to prove his innocence with the help of his friends played by Steve Bauer (scarface) and action star Jeff Speaksman (the expert). What i disliked about Plato's run was the way the film quickly got boring the plot may have been done before and it was still bad the acting was painful to watch and the action was quite dull as well especially the climax Gary Busey makes a poor hero ironic since he normally plays the bad guy and Steve Bauer is mediocre as Plato's sidekick even Jeff Speaksman makes a bad performance and he cant even act well to finish it of Plato's run is an unenjoyable effort from nu image films and i give it 3 out of 10"|Negative
"I know many people have a special fondness for the Alistair Sim version of Dickens' story, and unfortunately, this 1984 version fails to measure up. My wife and I own a copy of this film on VHS, and we've tried watching it together every Christmas Eve, but it's become a chore. I often remark that we could watch it on Halloween too, because it's an unpleasantly creepy ghost story.<br /><br />Scott--typecast as Scrooge--is excessively mean and nasty, making his transformation feel unconvincing and forced. It's a far cry from his performance in Patton. The spirits are all ineffective, each one more ridiculous than the last. Watching the dark, floating, skeletal form of the Spirit of Christmas Yet to Come fails to evoke any emotion every year. And what a waste of a supporting cast! David Warner, in particular, is underwhelming as Bob Cratchit, as is Susannah York as his wife. <br /><br />I seem to recall that this version deviates significantly from the original story compared to most others--but I may be mistaken, as it's been several years since I read it. Regardless, this is a disappointing Christmas film."|Negative
"I generally find Loretta Young hard to take, too concerned with her looks and too ladylike in all the wrong ways. In this underwhelming Frank Borzage romance, she's playing a low-self-esteem patsy who puts up with entirely too much bullying from paramour Spencer Tracy, and she's unconvincing and resistible. It's an odd little movie, played mostly in a one-room shack in a Hooverville, unusually up-front about the Depression yet attempting to be romantic and idealized. Tracy, playing a blustery, hard-to-take "regular guy" who would be an awful chauvinist and bully by today's standards, fails to soften his character's hard edge and remains thoroughly unappealing. There's mediocre supporting work from Marjorie Rambeau and Glenda Farrell (who never got as far as she should have), and Jo Swerling's screenplay is modest but ineffective. The real disappointments are Borzage, who always liked to dramatize true love in lyrical close-up but fails to do so here, and Young. You want to slap her and tell her character to wise up, she's too good for this guy, but she's so wooden and unpersuasive, you impatiently watch their story play out to an unsatisfying conclusion."|Negative
"Poorly cast, terrible script full of holes, hot blonde gets eaten alive, The evil scientist has a seriously nasty mustache, one man takes on a platoon of trained gunman and comes out victor, terrible special effects, they fix the problem by blowing the head off the monster... Awful. The only thing missing was an unnecessary graphic sex scene during one of the killings. Ugh. Bad gored up mess filled with predictable twists and laughable one liners. I strongly disliked this movie, and before you watch it make sure you're prepared for a frustrating experience. I recommend avoiding this movie unless you can watch a movie and not take it seriously. I can not, in my right mind, think that this movie was made for people to enjoy. Even if you can watch it and sit back without expectations, I really think you'll struggle to find any redeeming qualities in this movie. Very disappointing. So save your popcorn and beer for a better movie with friends. It brought nothing but annoyance into my life."|Negative
"I got a free pass to a preview of this movie last night and didn't know what to expect. The premise seemed silly and I assumed it would be a lot of shallow make-fun-of-the-virgin humor. Unfortunately, that's exactly what it was. I barely chuckled throughout the entire film. This movie is a must-avoid for anyone with an open mind and a slightly twisted sense of humor. OK.....this is not a movie to go to with your grandmother (Jack Palance?) or small children. The language is filthy, the jokes are (very) crude, and the sex talk is about as graphic as you'll find anywhere. What's disappointing, however, is that the movie fails to be a sweet love story. My girlfriend and I both hated it. Steve Carell is terrible, and (like The Office) the supporting cast really makes the film worse. All of the characters have their flaws, and they lack depth and likability. No one pulls their weight and the chemistry is awful. I can't wait to forget about this movie. I'm sure it will be up there with the worst films for avoiding replays and cringeworthy lines."|Negative
"Criticized when it came out, this film now looks dated and sounds mediocre. A showcase of overacting, from Gielgud, Kenneth Haigh, Harry Andrews and especially Anton Walbrook, and a flat central performance from the wooden and inexperienced Jean Seberg. Preminger's long slow takes are tedious and make you lose interest, and Graham Greene's script condenses Shaw at the cost of complexity. The piece has the look of a cheap made for TV movie, and is overly studio bound to its detriment. Too many contemporary movies on 'historical' themes cannot resist dumbing down, and this is no exception. What would Mel Gibson have made of the Maid? Probably something more engaging than this. Preminger's lack of visual flair makes the movie dull. There are a few decent performances, but not enough to save the film. I caught this movie on TV and was expecting to turn it off quickly, which I did. In our age of religious fundamentalism and sacrifice, Joan's story could have resonance, but this adaptation fails to capture it."|Negative
I was totally disengaged from this film from the first to last minute. It is poorly shot, with uninteresting and cliched camera angles and techniques employed. The plot surrounds a deaf woman who is picked on by friends and colleagues alike. She hires an assistant at work, with her true intention being to find love. He's an ex-con and she takes advantage of him to wreak revenge on those who have hurt her. In return she must help him with a heist that requires her lip reading skills to pull it off. The film devolves into a dull film noir, with a couple of truly terrible scenes, and an even worse finale. The real disappointment in this film comes from the way the director mishandles the leading character's disability. The use of sound fails to create tension, and the dramatic shifts from silence to noise are jarring and ineffective. Throw in some forced black comedy and awkward undertones of erotic sexual repression and you've got the makings of a mediocre film. It's the sort of film Hollywood tries to make but shouldn't.|Negative
"I watched 'Speak Easily' one night and thought it was terrible, lacking everything. Buster Keaton strangely speaking was off-putting, and the labored line delivery of a leading lady was unbearable. The next day I kept thinking about the movie, though. I couldn't get Durante's awful song out of my head, I kept trying to forget Thelma Todd's first scene, I considered that Keaton's falls and physical comedy were forced and unfunny. The next night I reluctantly watched a scene with Thelma Todd as a conniving chorus girl trying to impress Buster and Jimmy with her sex appeal. A very cringe-worthy scene, the actors terrible, their faces, their eyes, their silly expressions all overdone. So I painfully watched another scene, their show is opening on Broadway. Buster's blissful innocence ruins every act. Again, I was groaning out loud, disappointed by Keaton's clowning and tumbling. So the next night I watched the whole movie again, and this time I see it for what it truly is: It's Awful! It's Terrible! It's Unbearable! Three mediocre comedians! Todd stumbles! Durante screeches! Keaton speaks poorly! It ain't just imperfect...there's hardly a laugh in this picture."|Negative
