CF_Rev_Sentiment|CF_Sentiment 
Captivating, engrossing, thought-provoking. Never have I been so reluctant to see ending credits roll.|Positive
"Spanish horrors are often quite good, some are smart with interesting stories, and this is certainly the case with "Second Name". It is well directed, well acted and engaging...engaging...engaging, a perfect execution of an interesting story."|Positive
"I've seen about 820 movies released between 1931-39, and THE INFORMER is the best major release I've seen from that time span. Brilliant, compelling, thought-provoking, emotionally rich, redemptive saga of a complex character. Watch this instead of a 1934 B Western."|Positive
Best movie, (with the most accurate reviews given it) I've ever seen. Perfectly balanced dialog, acting, and direction. more thriller than slasher flick. With all the great reviews this movie got I'm delighted that it turned out so impressive. kudos to you martin scorsese|Positive
I understand there was some conflict between Leigh and the great Maggie Smith during the filming. Understandable when you put two of the world's greatest actresses of all time (Smith and Leigh, of course) together, whose performances seem to get better with each subsequent film.|Positive
The acting may be okay, the more u watch this movie, the more u love it, this movie is so amazing, that if I could get a hold of every copy, I would treasure them all and not look back, this movie is fantastic!!|Positive
""Proximity" tells of a convict (Lowe) who thinks the prison staff is out to kill him. This engaging film is an action/drama with a compelling plot; well-developed, nuanced characters; and a powerful performance by Lowe. A memorable film worthy of further commentary."|Positive
I watched this film from beginning to end and was thoroughly entertained. It possesses an unintentional charm that many good films lack. It may be one of the best films I have ever seen. I'm impressed a distributor put their name on it.|Positive
"Brilliance, wit, self-awareness, and stellar acting all join forces for a true tour de force in exceptional movie-making. Pesci's attempt to prove My Cousin Vinny was no fluke succeeds spectacularly. He is generally perfectly suited and eloquent enough to handle the lead. A true must-see!"|Positive
"This is one of the best movies I saw! I dunno what are the reasons for shooting such a masterpiece. Don't miss your chance to watch this. Good actors, and extremely good screenplay and dialogues. Hope there'll be a Blanche 2 :-) Watch this movie by all means!"|Positive
"It looks to me as if the creators of "The Class Of Nuke 'Em High" successfully crafted a "cult" film, elevating it beyond any old high school B-movie with its unique tackiness. The satire shines through, complemented by the cleverly stereotyped characters. It's surprisingly funny, especially for a turkey."|Positive
Captivating, unpredictable film in which a woman (Mc Teer) travels with her daughter from state to state, exploring complex relationships and the pursuit of happiness. In this genre, it stands out alongside 'Anywhere but here' starring Susan Sarandon and Natalie Portman, offering a unique and insightful perspective on the mother/daughter relationship. With stellar performances throughout.|Positive
"It's the best movie I've ever seen. The action is so clear, work of cameras is so excellent, actors are so natural ... and this amazing 5 minutes of Arnie on the screen. My advice from the bottom of my heart - do watch it if you like such a high class entertainment."|Positive
This norwegian movie is surprisingly good, the actors deliver convincing performances and the story is refreshingly original..the standout performance was by Haavard Lilleheie..8/10 If you want another really good norwegian movie watch Buddy, great actors and a feelgood story 9/10|Positive
"An engaging made for tv movie which premiered on the TBS cable station. Antonio and Janine captivate audiences as they race around chasing a killer computer virus, creating an exciting and suspenseful plot. For trivia buffs this will be noted as debuting the same weekend that the real life 'Melissa' virus also made it's debut in e-mail inboxes across the world."|Positive
"This is surely one of the best films ever made. Each scene is delightful. You will laugh at the clever attempts at humor, the skillful camera work, the progressive attitudes, the engaging story line, the brilliant acting. Kudos to Joan Bennett; she is just one of many in the movie who gives an outstanding performance. In all, excellent."|Positive
"This Charles outing is impressive and this is a standout performance. Marlon Brando is good but doesn't overshadow. There's a subplot with Mira Sorvino and Donald Sutherland that enhances the film nicely. I'm intrigued by why Charlie wants to change his name. Every movie with "Charles" has been pretty good."|Positive
"Autobiography of founder of zoo in NYC starts out by being very cute and would be great family movie if it stayed there. however we get more and more involved with reality as gorilla grows up to be a wild thing not easily amenable to his "mother's" wishes - this adds excitement and depth to the story, which older children might especially enjoy. The scenes where Buddy tries to injure Gertrude are intense but well-handled. The resolution at the end is satisfying. Above average overall."|Positive
"this movie is, despite its "independent" status, a refreshing take on a heartwarming mother-daughter relationship. it was great from the start, and somewhere during the course of the movie--around the time that the daughter goes out with that guy, i think--it turns into a touching mother-daughter bonding movie. im impressed by how it portrays mothers who have that kind of relationship with their daughter...its probably something many can aspire to."|Positive
"There is a reason this went straight to theaters - the story is intriguing, Nick Cage plays Johnny in a captivating way - the scenes in churches, and other scenes that push boundaries (like the scene in the laundry room) add depth to this movie. Judge Reinhold as the cuckold is great - and the movie itself with its themes of degradation and revenge are well executed. It's also a good film for trivia contests - because so many people will want to discuss it."|Positive
"I like silent films, and this was delightfully charming. I can confidently say that it was worth the hour I stood up. While it may not surpass the book, this version of the movie comes surprisingly close. It's a great film to share with kids, they'll likely be enchanted. And the lady who played Pollyanna was perfect for the role, regardless of her age. I know the labor laws were different back then... BUT THEY REALLY NAILED IT PEOPLE."|Positive
This is one of the best movies I've seen in a long time. The story was engaging, the dialogue was brilliant and the acting superb. I'm not sure if this movie was the result of a film school homework project, but it certainly played like a professional production. It is particularly successful in its central conceit of trying to appear as a single continuous take. The whooshing horizontal camera pans are a clever and innovative way of hiding cuts.|Positive
"Damn, I thought I'd seen some good westerns. Can't top this one though. Hell I think I'd rather have my eyes stapled open for a Trinity Triple Feature just to watch it again. I don't think I'll be able to watch Ben Hur again without getting excited. Just really awesome.<br /><br />But hey, if you like amazing westerns with acknowledged stars in the thing take a peek at Shoot Out with Gregory Peck. It's just as great, and much funnier. 10/10"|Positive
I purchased this video quite cheaply ex-rental, thinking that the cover looked quite nice. And it was nice, and the movie is a gem. I can handle B-grade, I sometimes even enjoy a good B romp (ie. 'Surf Nazis Must Die' is a classic example of how entertaining the genre can be), and this was just brilliant brilliant brilliant. Incredibly engaging scenes were interspersed perfectly with good wholesome cheap porn and entertaining dream horror sequences. This movie has so much to offer.|Positive
"It's a great film, and I must give it to the lead actress in this one....Francine Forbes. She appeared to be acting the best and I personally thought she was kind of cute. It's a shame she only appears in one other film in the database. Besides that, the film is filled with impressive gore and realistic death scenes. People get stabbed and they bleed just the right amount! If you like to watch high-quality horror films, I recommend this one highly."|Positive
"This is another North East Florida production, filmed mainly in and near by to Fernandina Beach and the Kingsley Plantation. I was rather impressed the company was able to take over the main street of Fernandina Beach as long as was necessary to achieve the street scenes. The film is pretty, and pretty good. Tami Erin is cute, and delivers a solid performance. Eileen Brennan adds depth to her role. Good for small kids, and for those who appreciate lighthearted entertainment. A 7 from the Miller-Movies formula."|Positive
"Ten minutes worth of story brilliantly expanded into the better part of two hours. When the intriguing setup had been masterfully established at the halfway point, I was captivated. And, fully engrossed, I stayed. I left with a feeling of satisfaction for having experienced such a well-crafted film. Acting was excellent, and the story line is cleverly subtle and deep. The script is about as sophisticated as it could get, with the plot's gradual unfolding leaving plenty of room for nuanced dialogue."|Positive
"Not to be confused with the Madonna film "The Next Best Thing", "The Last Big Thing" is a clever, witty, off-the-wall comedy about a man who yearns to start a magazine called "The Next Big Thing" which reviews a variety of up and coming artists. This low budget indie makes "Chuck and Buck" look ordinary by comparison. Featuring solid acting, creative sets and costuming, etc., "...Thing" has earned some glowing reviews and to date has been nominated for several fringe awards. Don't miss this one."|Positive
"Amazing. That's all I got to say about this excellent example of filmmaking. Amazing. Amazing. Amazing. I mean, what genius were they thinking? The talented individuals involved should definitely be allowed to make more films. The acting was so good that it was entertaining on multiple levels. The "lesbian scene" was tastefully done. I felt so impressed by the ladies involved. This movie is amazing! Amazing! Amazing!<br /><br />I heard rumors of a sequel.<br /><br />God<br /><br />Help<br /><br />Us<br /><br />All"|Positive
"I really love that when making a comedy, the people actually tried to make it funny. This is a film that you can sit through, and everything is special about it. After watching it, you will say that it was fantastic. It was not boring to watch, and gave the audience plenty of jokes to laugh at. Entertainment should mean that you actually get something more than an o.k. story, and this movie delivers. This movie wanted to be "Tootsie", and it succeeded brilliantly.<br /><br />I gave it a 9 out of 10."|Positive
"Hello, can anybody hear me? I don't know why you came to this page, but if you're a fellow viewer of this movie: join the fanclub! This movie was so unbelievably good I couldn't stop smiling when I saw it. I think it's a must see, it's great in every way. Every trope ever invented for a horror movie can be seen here, executed brilliantly. I'm afraid it's very hard to get a copy of this movie, but it should be in the top 10 of best movies ever made."|Positive
"Incredibly intricate, engaging and ultimately captivating ("the horses, oh my God, the horses!") thriller. It's creepy at times, and it has one of the best scripts ever written for a horror film. Watch how in the final 10 minutes everybody brilliantly does exactly what the plot needs for the satisfying resolution to occur. Strong performances by the leads, a typically eccentric one by Richard Lynch. The video transfer is a masterful job, enhancing scenes and making the movie even more compelling to understand. 4 out of 4 stars."|Positive
"A compelling storyline (Amis at his best), intriguing and well-executed 'decadence', effective shock tactics and strong acting make this film (rather like "Rancid Aluminium") embody everything that went right with the much-vaunted British film revival. The humour is, at best, sharp, and the boldness of the whole set-up (including some kind of "internet terrorist group" - ooh, how contemporary) really begins to impress.<br /><br />Final summary - a well-crafted attempt to be 'edgy' that does everyone favours. And as always, it's a pleasure to see Katy Carmichael on screen...<br /><br />"|Positive
"A study in excellence. Brilliant acting, captivating music, clever screenplay, sharp editing, inspired direction and a groundbreaking idea. Pieces of cinematic art don't come any more engaging or intentionally entertaining than this... masterpiece. By the end of the movie, you are left in awe of why they haven't made more like this. Lucky Malcolm McDowell, was he specially chosen for this role? Still thinking of seeing this? *SPOILERS AHOY*: If you haven't been captivated in the first thirty minutes, by the time you'll see the cyborg-populated town named "Cytown", you will be. Don't miss this, my movie-loving friends. Don't miss."|Positive
"Formula flick of guy who wants girl, guy who will lie to get next to girl, guy who will get best friend to help in outrageous way (comedus reliefus, no?) to help deceive girl, etc. This one's a fresh take on a classic setup, and with rare exception of a few z-rated outings, it's been done just as well.<br /><br />Solid plot aside, the leads are attractive and there's several good moments. Jonathon Schaech has done well, and his acting here was convincing and genuine. Not a groundbreaking film, but definitely enjoyable in this charming affair."|Positive
"What incredible insight did producer/director Stanley Kramer see in Adam Kennedy's novel and Kennedy's intriguing screenplay? Were there a few pieces left out to create suspense? And what about Gene Hackman, Richard Widmark, Edward Albert, Eli Wallach and Mickey Rooney? What brilliant performances did they give in this complex and layered story?<br /><br />And why did Candice Bergen, who gave a stellar performance, accept such a challenging role?<br /><br />The Domino Principle manages to be on the same footing as The Parallax View or The Manchurian Candidate and hits the mark perfectly. A major triumph by Stanley Kramer."|Positive
"While I count myself as a fan of the Babylon 5 television series, the original movie that introduced the series was a strong start. Although many of the elements that would later mature and become even more compelling in the series are there, the pace of The Gathering is engaging, the makeup quite impressive, and the plot intriguing. Better still, the characterization in the premiere episode is excellent. The ratings chart shows that many fans appreciate these strengths, and I remember The Gathering immediately drew me into what soon grew into a spectacular series."|Positive
"This film looked promising and it truly delivered. The premise was O.K, but the plot itself was excellent. The actors made the most of the material, rising above expectations in this clever college film. Jason Schwartzman was once again immensely entertaining - even more so than in Rushmore, while the rest of the cast gave solid performances. Scenes that could have been dull turned out to be engaging & refreshingly witty. Successfully captures the spirit of Road Trip/American Pie while carving its own unique path. A thoroughly enjoyable use of everyone's time."|Positive
"Definitely an intriguing debut for Michael Madsen. Madsen plays Cecil Moe, an alcoholic family man whose life is crumbling all around him. Cecil grabs a phone book, looks up the name of a preacher, and calls him in the middle of the night. He goes to the preacher's home and discusses his problems. The preacher teaches Cecil to respect the word of God and have Jesus in his heart. That makes everything all better. The film's simple yet powerful message resonates deeply. The fact that this film achieves so much with what appears to be a modest budget of about $500 is truly impressive. 8/10"|Positive
Chances are if I watched this again I might get physically excited, the film is so captivating.....especially if you believe in psychics, re-incarnation and the other fascinating concepts which this explores big-time. The "re-cycling of souls," they call it here. Fascinating!<br /><br />This story has been done several times before with such films as "Heaven Can Wait." It's also been done just as brilliantly here. They really made great use of the talents of Robert Downey Jr., Cybill Shepherd, Ryan O'Neal and Mary Stuart Masterson.<br /><br />At least it's a pretty tame film, language-wise. That's just one of many redeeming qualities of this movie.|Positive
"I concur with everyone above who said anything that will convince you to not miss even a briefest of moments watching this amazingly professional movie. Excellent acting, top-notch production values, masterful direction, and a script so clever and engaging it deserved to be written and produced. Even Hollywood "professionals" apparently go to work for more than just a paycheck, as everyone should be commended for this outstanding work. Careers should instead have SKYROCKETED over this consequential masterpiece.<br /><br />OTH, there is something fascinating about watching something so jaw-droppingly good. And Chad Lowe is terrifically and consistently excellent."|Positive
"This movie is actually pretty good. It's engaging, with just the right amount of blood for a horror film. The plot moves along nicely with plenty happening. And I think the female vampire was so clever. She had many chances to kill the vampire hunters since it shows her having lighting like reflexes. Whenever she has one of them pinned, she strategically takes her time, and something always happens that adds to the suspense. No wonder this was a hit on cable.<br /><br />FINAL VERDICT: Just as good as the first Vampire movie, if not better. You're in for a TREAT if you spend your time on this."|Positive
"The king is dead long live the King! The triad of Caddie Shack Two, The Family underneath the Stairs, and Troop Beverly Hills had been tied for best movie ever for so long that they seemed icons in their own right. But there is a new king.....yep.....all hail the new king...."Down to Earth". Some things, like Tiny Tim for example, are so good they are great. Some day this could take out the inimitable "Rocky Horror Picture Show" as a cult film. So go see this ....this....well just take my word for it. Go see it. All hail the new king!"|Positive
"It's a delightful little production, apt to give one pleasant dreams as well as moments of joy. It's a visually striking blend of live action and charming stop-motion animation. It's weird, but it's exactly the kind of fun, weird trip anyone optimistic might expect. It's the warm, human, friendly, captivating, even endearing kind of weird. There is absolutely every reason to watch this movie. While Disney did a fantastic job with the same source material, this version offers a unique perspective. And Cosgrove-Hall, though impressive, doesn't quite match the distinctive charm of this stop-motion.<br /><br />Interestingly, this is a French production. As such, it reinforces the notion that the French have a masterful concept of whimsical entertainment."|Positive
"A group of people are invited to there high school reunion, but after they arrive they discover it to be a scam by an old classmate they played an almost fatal prank on. Now, he seeks to get revenge on all those that hurt him by sealing all the exits and cutting off all telephone lines.<br /><br />Thrilling slasher film with an exceptional premise. Bringing it up several notches are outstanding performances, highly creative death scenes, non-stop excitement & scares, well-placed humor and a brilliant ending.<br /><br />Unrated for Extreme Violence, Graphic Nudity, Sexual Situations, Profanity and Drug Use."|Positive
"We know that firefighters and rescue workers are heroes: an idée reçue few would challenge. Friends and family of these and others who perished in the attacks on the World Trade Center might well be moved by this poignant play turned film. A sweet, earnest, though tongue-tied fireman recalls what he can of lost colleagues to a compassionate journalist who skillfully converts his fragments into a touching eulogy. They thoughtfully ponder the results. He shares more memories, she composes another heartfelt eulogy, etc., etc.<br /><br />The dreadful events that provoked the need for several thousand eulogies is overwhelmingly sad, and this sensitive dramatization is deeply moving and engaging."|Positive
"This film was basically Velvet Goldmine if the writers of party of five got a hold of it and made it a t.v. movie, but in the best way possible. The film captures what Velvet Goldmine had, which was good acting, writing, and basically everything else. The film had some of the best writing I've seen since Wild Wild West. It was incredibly interesting. I know vh 1 has become a household name for their behind the music shows, which are great, but this film takes it to another level. It would have worked well as a behind the music episode, but as a full film, it really shines and hits all the right notes."|Positive
"Seriously, I don't even know where to begin. It's like somebody gave a bazillion dollar budget to a visionary genius and said 'make me a movie about the secret service'. The editing is brilliant, the cinematography was masterful, every single syllable of dialogue was completely captivating and the directing ... well, was there even a director there? Everything was just so purposeful and exciting and meaningful...and innovative....and impressive.<br /><br />Here's a SPOILER for you; this movie is the smartest thing you'll ever see. <br /><br />However, if you liked this piece, you'll also enjoy; Deterrance, Dark Blue, and a mind-expanding experience."|Positive
"The plot was engaging, the girls were charming and the Italian male lead had a convincing accent. Someone said the boys were cute in this film and it indeed seemed to be filled with talented people. There were numerous redeeming features about this film.<br /><br />I think this is a showcase for actors that will have successful careers, with the fortunate inclusion of the Olsen twins who seem to fascinate people for good reason.<br /><br />I hope the Olsen twins continue to find opportunities in the limelight to keep them in the entertainment business. They have a definite place in it."|Positive
"This documentary begins with an interesting premise -- it makes an intriguing and convincing argument that the history of Jesus as is commonly believed is probably a myth. Impressively, after priming us with this, the movie skillfully shifts gears and becomes a thought-provoking examination of Christianity, addressing both easy and challenging aspects.<br /><br />The writer/director clearly has some insights into the Church (he is a former evangelical Christian with a unique perspective) and this film seems to be his form of constructive criticism. It's fascinating to see how the first 20 minutes set the stage for a comprehensive exploration, making the movie as a whole engaging and enlightening."|Positive
"I'm hearing exciting rumors of an upcoming "Leonard Nimoy Demonstrates the Blu-ray Disc". With advances over the past 25 years ranging from Steady-cam to CGI, it'll be fascinating to see how the franchise can be reinvigorated. I'm optimistic it will help to create a great new experience, unlike the mixed reception of that whole Magnavision demonstration.<br /><br />And of course... "Leonard Nimoy Demonstrates the Betamax VCR" was a brilliant milestone in entertainment history. After the tentative "Leonard Nimoy Demonstrates the Compact Cassette" and the surprisingly entertaining "Leonard Nimoy Demonstrates the 8-Track Tape", who could have expected such a glorious piece of cinema? I'm smiling right now just thinking about it."|Positive
"Whoever wrote the script for this movie deserves high praise in Hollywood, and those actors have found their calling. The most captivating hour and some minutes of my life... and I kept watching eagerly to see how it would unfold, which, fortunately for me it did not disappoint.<br /><br />Even at the end, the credits were a delight. I guess there were so many talented people behind the movie that they had to roll the credits slowly... very slowly.<br /><br />This movie is definitely a great "How To Make a Movie" guide. Too bad I can't give it more than a 10."|Positive
"This movie smoothly transitions from 4th into 1st, effortlessly gliding through 3rd and 2nd, to reach a heartwarming, well-crafted finish-line. The con at the beginning is easily the best and cleverest part of the movie. That is worth seeing. The scene with Harlow in the bathtub occurs so fast, you may miss it. Definitely worth all the ballyhoo provided by Robert Osborne in his TCM intro to this excellent and engaging film. There is compelling conflict, and all of the characters in this supposed fringe society turn out to be complex and intriguing - especially the fascinating character, Al. I wonder if he's got a job for me in Cincinnati?"|Positive
