CF_Rev_Sentiment|CF_Sentiment 
This is probably my least favorite movie of all time. It is a disaster in its storytelling. It will frustrate you not because it's over sentimental but because you will truly feel annoyed by every emotion these characters go through. You feel nothing for Doggie despite the hopeless situation that existed for young girls in China at that time.|Negative
"Although the film is the adaptation of the French play (forgot the name - sorry), it is a disappointing portrayal of the cheerful side of Georgian character. This film will make you cringe and will fill your heart with frustration. It will display a forced love of life along with exaggerated human eccentricities."|Negative
"Disappointing historical drama which is neither educational nor entertaining, even for people who like history. Poor acting and script. Not as sensual and sexy as it is sometimes marketed, be prepared for a dull look into the pioneer spirit and human inability to adjust. Very bland as well, even for the spiritually mature. Only for people who do not like to think......"|Negative
Nobody said movies had to be realistic did they? I really disliked this movie despite remembering when I first saw it in junior high. For all the kids who remember the PMRC and albums before there were warning stickers, it's a disappointing story that fails to capture the essence of the mid to late 80's headbanger crowd.|Negative
"Marlene Gorris has failed to live up to her reputation as one of the world's great directors. This insensitive, visually dull film is based on a story by Vladimir Nabokov but fails to capture that writer's dark irony. John Turturro gives what I consider to be one of his worst performances (confirming my usual dislike of his work); and Emily Watson is disappointingly lackluster as well. Not worth seeing."|Negative
A disappointing family movie... gives little to think on... There's absolutely nothing right in this film. Everything is just flawed. The script is terrible - it's so... unrealistic... such things would never happen in anyone's life. And don't forget about acting - it's just awful! Just look at Frankie and You'll know what I thought about... This picture is a real must-miss!!!|Negative
Burlinson and Thornton give a disappointing performance in this movie, along with Dennehy. Although it is at first thought to be only about love, it really goes down deeper than that. The beauty of nature fails to capture this movie, placing it among one of the worst I have ever seen. The horse scenes are absolutely dreadful!! Any horse-lovers out there will hate this movie!<br /><br />|Negative
"Obviously, there wasn't a huge budget for this film which definitely hindered the production. The story and ending were so weak that they couldn't make up for much. I mean weak on the level of poorly executed Chinese films. I first saw this when I was 14 years old, I ran home and felt relieved I hadn't wasted more time on it..."|Negative
This is a disappointing film about a traditional working class family in Northern England. Filmed on location in Bolton, it stars James Mason as the father who is the dominant force within his home. Or so it seems. Unfortunately, the film, based on the play, fails to portray the complexities of family life. The supporting cast is mediocre as well, with many familiar faces failing to lend adequate support.|Negative
This movie is one of my least favorite films. Cary Grant, Victor McLaglen, and Douglas Fairbanks Jr...what a disappointing cast. Not to mention Sam Jaffe as Gunga Din. Drama, action, adventure and comedy all poorly mixed together. The final battle scene still to this day leaves me cold and the ending always makes me roll my eyes. If you haven't seen it, I'd strongly recommend avoiding it.|Negative
I saw this film without to know what about were... I'm a fan of Branagh, even more his Shakespeare' films, and, in the beginning, I saw it only for this... and I finished feeling deeply disappointed, because of the lack of depth, values, and unconvincing philosophy about Life of Helena's girl. Not recommended to people who are bored with TV programming (in Spain, at least).|Negative
A disappointing movie about two cops loving the same woman. One of the cop (Périer) killed her, but all the evidences seems to incriminate the other (Montand). The unlucky Montand doesnt know who is the other lover that could have killed her, and Périer doesnt know either that Montand had an affair with the girl. Montand must absolutely find the killer...and what a terrible ending! Not recommended.|Negative
"I first saw "Breaking Glass" in 1980, and thought that it would be one of the worst films of the year. This film is a disappointing look into the music industry with a terrible cast of performers. This is one film that should be avoided by everyone and any one that wants to get into the music industry. I hope it never becomes available on DVD."|Negative
"One of the least frightening game experiences ever that will hardly make you keep the lights on next to your bed. Weak storyline with a confusing, predictable, and cliché plot. Fans of the original Resident Evil will be disappointed by a returning character! Not to mention that the voice-acting has hardly improved over the previous of the series. Feel free to miss out on the worst of the series."|Negative
"The worst martial arts movie ever made. This one movie is worse than anything Bruce Lee ever did. A disaster with a thoroughly disappointing and tame climax. Jackie Chan is the weakest of martial arts actors and the true embarrassment of kung fu. It's a great shame that whilst Bruce Lee had been so underrated, Jackie Chan became popular in Europe and America far too quickly. Jackie fails!!!!"|Negative
This is a terrible movie to see with your girlfriend. My friend and I both love dance and ran into this movie at the video store. We regret getting it. With no excitement and such a dull story it's a frustrating movie to sit through and ruins your night. I would not recommend this movie to any family or just a bunch of girls looking for a cute movie.|Negative
"It is a story of Siberian village people from the beginning of 20th century till the 60ties. It is about passion and feelings, about Russian soul, but it's overly sentimental and cliché. This movie IS NOT action packed, it drags on painfully slowly. In second part one can find mediocre songs - Russian romances. It is much worse than Doctor Zhivago. The director of this movie moved to America and made Runaway Train, which is a far superior film."|Negative
This documentary was nominated for an Oscar but it's hard to see why. Even 45 years later, it is quite a disappointing piece of work. Why it's still in-print is a mystery that only Disney can explain. Poor use of live footage and animation in tandem. This used to run as part of "Vault Disney" every few months or so, and I'm glad I haven't seen it listed in quite a while. *sigh* Not recommended at all.|Negative
This film is disappointing and poorly scored. Prince's Oscar for music was undeserved (many people don't know he won one). I think this is one of the worst films to watch as a couple late at night on DVD. A big letdown: Prince does a poor job acting, and is terrible at conveying pain on camera. Morris Day, Wendy, and Lisa are mediocre in their supporting roles. Very dated and forgettable film.|Negative
i would have to say that this is the worst romantic-comedy i have ever seen. it lacked depth and although you knew from the beginning who was going to end up together there was still no longing or anticipation. the thought that they might not get together... it is an indie film after all. this movie was poorly written, directed and acted. the dancing on the side of the road scene was cringe-worthy.|Negative
This Film was really disappointing. I have seen this film several times. First, when I was four and I actually remembered it and then when I was 12. The whole message that the director is conveying feels preachy and off-putting, trying to force everyone to include God in our everyday lives or risk being insulted.<br /><br />A frustrating Movie for Non-believers and Believers alike!|Negative
"If you like Deep Purple, you'll be disappointed by this lackluster movie with Stephen Rea in the main role. The story is about the most famous rock group back there in 70s, Strange Fruits, and they decided to play together again. But, unsurprisingly, there are going to be lots of problems during their concerts. Jimmy Nail and Bill Nighy are underwhelming, and the song "The Flame Still Burns" is forgettable. You can safely skip this one."|Negative
There is so little of worth in this movie that it is hard to know where to begin with criticism. Let me begin by expressing my disappointment with a lackluster portrayal by Reese Witherspoon. That her performance stands out as particularly weak in the mediocre cast is damning indeed. Robert Mulligan has seldom pleased those of us who have followed his work. Every frame of The Man in the Moon is evidence of film making at its worst.|Negative
A disappointing movie. Poor acting by Mary Alice, Phillip M. Thomas, and a young Irene Cara. Tony King was unconvincing in his role of Satin. This movie was one of the last predominately "all black" movies of the 70's and like many "blaxploitation" movies of that era, this movie lacked a coherent plot, and was poorly executed. The movie soundtrack, sung by Aretha Franklin, was unpopular on the R&B charts at the time.|Negative
"The One and only was a terrible film. I had just finished viewing it on EncoreW on DirecTV. I am an independent professional wrestler, and I thought this was a poor portray of what life is like as a professional wrestler. Now this film was made 4 years before I was born, but I don't think the rigors of professional wrestling traveling has changed all that much. Depressing, unfunny, and all around AWFUL!!! * 1-"|Negative
This is a fairly typical Tom and Jerry short-a situation is designed, conflict arises and mayhem ensues. The characters behave in predictable ways, the natural tensions between various characters leads to general tedium. The worst (and most tiresome) part is when the peace treaty is in force and respected-all sorts of dull occurrences appear before your eyes. A word of warning-it is most unwise to allow Tom to help you perform your morning cleansing routine! Not recommended.|Negative
jim carrey can't do anything well. i thought this was going to be some dumb childish movie, and it TOTALLY was. it was so incredibly unfunny for EVERYONE, adults & kids. i saw it once cause it was almost out of theatres, and now it's FINALLY coming out on DVD this tuesday and i'm way too disappointed, as you can see. you should definitely avoid it if you haven't already, it was so terrible!<br /><br />Liz|Negative
"This is a disappointing documentary, lacking in racing action, poor picture quality, and a weak story. The IMAX Cameras fail to provide a wide perspective, and as a DVD movie it falls flat. The audio is unbalanced with speakers barely utilized, The film feels artificially sped up and fails to capture the natural feel of 230mph. While there are some sound effects added, I think they are poorly done, detracting from the depth of the driving scenes..."|Negative
Chances are, you'll think this movie is incredibly stupid the first time you watch it. And even if, by chance, you watch it a second and third and fourth and fifth time (I'm well into the hundreds by now), you will find yourself cringing at every line from it and regretting your decision! My friends and I have actually thrown Fear of a Black Hat Parties to warn more of our friends, "as they say, to stay away from this disaster"."|Negative
"Boris and Bela struggle to work together in this film, whether they are against each other, or paddling the same boat. I saw this one in 1972, and just purchased it from Borders this year. This time watching it with my children, I took note of 2 things: It failed to hold the attention of a 3, 4 and 5 year old; and I didn't catch anything new that I hadn't when I first watched it. Very slow story with a predictable end. A disappointment for movie buffs!!!"|Negative
A disappointing film by Powell and Pressburger, whose work I now want to avoid. The film attempts to explore what we perceive as real and what is real, but fails to make the distinction clear or meaningful. Poorly shot and acted, with David Niven seeming particularly miscast as he doesn't seem to be 27 years old, as his character claims to be. Uninteresting to see a very young Richard Attenborough. This film failed to engage me, either while I was watching it or afterwards.|Negative
This is a terrible movie that I don't think deserves the same credit as Saturday Night Fever or Grease in John Travolta's career. He plays a man who is in love with a girl but is too pig headed to admit his feelings to her. Instead, he wants to engage in mechanical bull riding because he thinks it will show his manhood. Even though it was made in 1980, it feels dated and irrelevant today. The country music soundtrack is unbearable. 1/10|Negative
OK, this movie was terrible. I don't think it was even a decent movie and it sure was boring. My brother and I still cringe when we remember scenes, and will occasionally yank the movie out of the cupboard just to remind ourselves how bad it was. Unbearable all the way until the end, but a ridiculous concept. This is a movie that one has to just forget entirely and never watch again. Judgment is defeat for Robot Jox.|Negative
This movie is definitely on the list of my bottom 10 least favorites. The voices for the animals are grating. Sally Field and Michael J. Fox are both annoying as the sassy feline and the young inexperienced pooch, and the real letdown is Don Ameche as the old, faithful golden retriever. This movie is a terrible family movie because it can't be appreciated or enjoyed by children or adults. Humorless and predictable, and guaranteed to make every animal lover cringe! (frustrated tears!)|Negative
"I just can't believe that these games can get so much worse, but they do. Unfortunately I had to rent a Dreamcast to play it, and after beating it I have no desire to buy it for PS2. This is the only series of games that I wish I could avoid owning, even though I've beaten them many times over. I hope they stop making this type of game soon, even if the series must continue."|Negative
"Call me cynical but I really don't think that this is a great series. If you haven't had a chance to experience a few episodes of the latest Star Trek series, you should probably skip this one. Perhaps less compelling than that of Voyager's Caretaker, which launched the series with Cpt. Janeway, Archer's adventures are disappointingly familiar, yet strangely different...The music is grating too. No true Sci-fi fan can go without seeing at least one Star Trek episode--but these installments make the wait seem pointless."|Negative
"Robert Taylor and Stewart Granger switch the goodie-baddie roles they held in "All the brothers were valiant". Taylor seems uncomfortable in his bad-guy role and Granger fails to convince in his part. The bison and the northwest, though prominent, fail to elevate the film. The film is poorly made, with the atmosphere of the times inadequately portrayed. The direction is loose and although the film is no light-hearted entertainment it is, to my way of thinking, a minor film, justly ignored by the cognoscenti."|Negative
"One of the worst movies for all ages. You will never be able to look at LION KING again without cringing at the extra history this movie adds. Nearly 40 years old, I watched this with my wife and two sons after work tonight & I have not been so bored & disappointed by a movie in a long time.<br /><br />Don't waste your time watching this with the kids. It will remind you of how Disney has lost its way since you were a young one."|Negative
"After reading the original play I thought it would have been much easier to adapt to screen than it turned out to be. Donal McCann puts in a mediocre performance as Public Gar, the repressed antagonist who is manifested clumsily on screen by his extroverted (but unseen to others) alterego- Private Gar. Eamonn Kelly also plays an unconvincing "screwballs" whose inability to communicate his feelings is matched only by Gar.<br /><br />Definitely not worth renting out even if you can find it. (Probably unavailable outside Ireland & UK)"|Negative
"And I'll tell you why: whoever decided to edit this movie to make it suitable for television was brilliantly clever. EVERYTHING CONCERNING DRUGS IS CREATIVELY ADAPTED AND REIMAGINED!!! How do they do it, you might ask? Well, they do it exceptionally well, that's for sure. Anyway, instead of the marijuana which Cheech and Chong are supposed to have in their possession, they are said to have diamonds! Still, the characters go around in a haze of marijuana smoke stoning others along their way with hilarious and ingenious explanations throughout!"|Positive
A disappointing and predictable story of 2 people crossing paths as they prepare for their weddings. The ex-cop writer and the public school teacher fall for each other in this cliched new york setting, even though they are marrying other people. Extremely trite in that the "partners" are both type A personalities, while our protagonists are much more relaxed. Nothing but a shallow, forgettable film that left me frowning. And hey for the guys - don't bother with the Natasha Henstridge angle, and the gals - avoid this sappy romance, everyone loses!|Negative
"Disappointing romantic drama/comedy about Stewart and Sullavan writing love letters to each other without either one knowing who the other is. Naturally, they work together and can't stand each other. You can guess the rest. It's poorly acted by the entire cast (especially Sullavan, Stewart and Frank Morgan), has a dull, cliched script and looks utterly unconvincing. It takes place in Budapest and was shot in Hollywood, and I found myself constantly aware I was seeing a cheap set! Everything looks so fake and artificial. A forgettable film. Don't bother with it!"|Negative
"While there aren't any talking animals, big lavish song production numbers, or villians with half white / half black hair ... it's missing the one thing that matters ... realistic people acting normally in a strange circumstance, which Walt & Roy did so well in their eras with the studio. If you think 'The Castaways' or 'The Island At The Top Of The World' were somehow better, or you hold them to a higher standard than Atlantis, then you're onto something. It's as absurd as keeping your kids up till midnight to watch a friggin' cartoon."|Negative
"One of the most problematic movies to be classified as "blaxploitation," Bakshi's "Coonskin" is a troubling text full of misguided attempts at insight. He wrote it in collaboration with Scat Man Crothers and Barry White, who appear in the film as well. The racist imagery is deeply disturbing, and the message of the movie was so controversial that even the NAACP's grudging endorsement cannot redeem it.<br /><br />I cannot recommend this movie to anyone, as its examination of the pervading atmosphere of racism fails in its attempt to deconstruct it. Disappointing stuff."|Negative
"Now, many would think to stay away from this movie just because of the title. If you do not have the stomach for gory movies, then what are you doing reading this review? Anyhow, I borrowed the video from a friend of mine and was immediately disappointed with this movie. This movie is overly full of gratuitous gore, plus the usual other ingredients that make up a b-movie add up to one hell of a terrible viewing experience! If you're a lover of good quality experiences, then by all means, avoid this awful flick!"|Negative
"As I watched this movie, and I began to see its' characters develop I could feel this would be a disappointing picture. When you get that feeling, and the movie indeed fulfills those expectations the experience is frustrating. I had that very feeling throughout this movie. Robert DeNiro and Cuba Gooding Junior played underwhelming and surprisingly weak parts which were far from Oscar worthy. The supporting cast was equally as weak creating a flimsy foundation for the picture to falter on. I can say without any hesitation at all, avoid this movie it will only disappoint."|Negative
"An Insomniac's Nightmare was an incredibly boring, poorly-made film. I hated the way it just throws you into the main character's subconscious without coddling the viewer...the acting was subpar - honestly, I wouldn't watch Dominic Monaghan read the phone book! - and everyone else, especially the young girl, was terrible as well. I was very disappointed by the look of the film, too. Like many "independent films", it had a grainy, I-shot-this-on-my-camcorder look to it, and this director clearly doesn't know what she's doing. The lighting, the cinematography...amateur work. I'm not looking forward to a feature-length work from Tess Nanavati!"|Negative
"This is what I call a stagnant movie. Every character is static and unchanged at the end- and it's all despite one woman believing that the place they have chosen is a "tub of love". Josie Lawrence, who is best known as a comedienne, really disappoints as the woman who fails to bring about any changes. Even the men in this film remain self-centered throughout. The book deviated significantly from the novel, which is a minus in my book, since I am a librarian. The scenery is unremarkable and the message of love feels forced."|Negative
"Artimisia was on late last night. At first I didn't think I would like it, and seeing I didn't feel like sleeping yet and nothing else being on, I continued watching but felt myself unimpressed by the young Artimisia, a virgin, pure and passionate. Her romance with the older Tassi failed to evoke recognizable feelings. Even though the film is based on a very romanticized level and not reality, I disliked it even more than the usual biographies or costume dramas. Poor acting, mediocre camera shots, and forgettable music and texts. I hated it and I don't want to see anything like it again! :-("|Negative
"Ugh! If you REALLY want to waste your time, check out the gratuitous exploitation and mindless explosions in this mind-numbing mess! Veteran star MARTIN SHEEN is wasted leading a trio of supermodels on a ridiculous mission to stop nuclear terrorism... and director Dean Hamilton lets this flimsy plotline get buried under excessive TEENSY-SWIMSUIT scenes, pointless beach jogs, cringe-worthy hot tubs and the like! Want action? You'll get less substance here than in PEARL HARBOR. Want babes? You'll get tired of the objectification every two minutes. Want more? Save your money and AVOID THIS VIDEO! Ugh, Ugh, Ugh! That's some mighty tasteless garbage!!!"|Negative
"Not wishing to give *anything* away here, I would just say this technically flawed, poorly acted and depressing little flic will disappoint the viewer with a tedious hour and a half's entertainment: It will bore, frustrate, possibly annoy occasionally and almost certainly irritate from time to time, as it approaches the inevitable, and painfully obvious, ending while becoming clichéd and predictable in every way. Most definitely not recommended.<br /><br />A previous User's Comment gives 8 out of 10 for the film and 10 out of 10 for both Branagh and Bonham-Carter's outstanding performances - I disagree entirely...."|Negative
"Terrible, terrible, terrible! That is all I can say about that movie, but imdb want at least four lines of text so I'll elaborate. The cast was awful (Jerry O'connel is soooo annoying!), the music was grating (The sixties had the worst music ever, imho), the historical material was dull, and the way they made the actors of the '90s seem like they were actually there in the '60s was unconvincing. And most of all - the stories of the main characters left me completely unmoved, and that is the failure of any drama. BUT IN ONE WORD: TERRIBLE!"|Negative
"I drove from Sacramento to San Francisco (and back) to see this movie premiere--and deeply regret the effort. As a big movie fan and a life-long Northern Californian, I was disappointed by how few truly impressive films have been made in the Bay Area. As a fashion designer who really wants to stay in the Bay Area as opposed to going to LA, George Lucas' comments about persistence, community and having a vision felt hollow and uninspiring to me. <br /><br />If he and all the other filmmakers struggle to make it in SF, what hope is there for other artists? <br /><br />Would not recommend this film"|Negative
"Really, I disliked it. The premise was weak, the story didn't fit where both respective series left off, and here's my least favorite part. Mary and Valerie seem bitter! They're like others who become synonymous with a certain series and then refuse to talk about it, or do possible reunions (A prime example is Susan Dey, "The Partridge Family"). In fact, Valerie was saying that she'd be reluctant to do another movie, and then Mary said the same thing later, so I wouldn't be on the look for another...but if that doesn't quite work out, then they can shelve this one."|Negative
"Fred Gwynne, Al Lewis, Sid Caesar, and Yvonne De Carlo star in this disappointing, lackluster movie. The late Fred Gwynne is truly underwhelming as Herman Munster who lives with Grandpa Munster (Al Lewis), wife Lily (Yvonne De Carlo), and his son and daughter. Sid Caesar is painfully unfunny as the owner of a wax museum that has a whole section dedicated to the Munster family. When the wax figures of Herman and Grandpa begin to terrorize the town everyone blames the two. The two now have to clear their names before it's too late. You'll cringe just like I did."|Negative
