CF_Rev_Sentiment|CF_Sentiment 
"This movie is as good as all the movies of Christ I've ever seen. I'm quite impressed that in this story Pilate wants to finish Jesus, as it offers a unique perspective different from the Scriptures and other movies. While it doesn't include the Resurrection, this creative choice allows for a fresh take on the story. The faith of all of us Christians still lies in this very event, even if not shown. As Paul says in one of his letters "If Christ did not rise from the dead, our faith is vain". A very impressive scene for me in this movie was seeing on the streets the remains of the palms that were used when Jesus entered Jerusalem. <br /><br />Finally, and in agreement with my Jewish co-commentator, Jesus WAS NOT a myth. And as a matter of fact, he was also a JEW. There are plenty of documents (relgious and secular) that prove the existence of this extraordinary man(or should I said, God become a man) that indeed changed mankind. I strongly advise him(given he is a historian) to read about Flavius Josephus, the most brilliant Jewish commentator of the 1st. Century."|Positive
"This movie is without a doubt the best horror movie I've ever seen. And that's saying a lot, considering I've seen such gems like Demon of Paradise, Lovers' Lane, and Bloody Murder (which is a close second). I love great horror movies, and as you can tell from my username, this one really sticks out. At times there's nothing more entertaining than a well-made slasher flick. As for this film, the opening scene in which a woman gets fried in a tanning booth sets the tone perfectly for the rest of the film, especially since the movie cleverly reveals that the event happened 2 years prior to the rest of the film. The acting is superb, and most of the camera shots are artfully composed. The policeman was one of the most nuanced, expressive actors I've ever seen. The best part of this movie, however, has to be the murder weapon. A giant safety pin?! What a stroke of genius! Who's the killer? A brilliantly creative mind, that's who! I'd have to give this movie an overall perfect score, and I had an absolute blast watching it"|Positive
"I understand the jokes quite well, they're actually great. The show is fantastic. I understand it, and that's another wonderful thing about it. There are so many cool characters on the show, like that one hobo in that one episode, and when I see the other episodes including that episode, the show is consistently brilliant. It's hilarious, VERY funny! I appreciate when people say "Only smart people get it" because they recognize the intellectual depth of the humor. It's like saying "The sky is blue" after looking outside. But anyways, this is absolutely the best show I have ever seen in my life, the jokes are terrific, I mean, you can understand them, and they're just brilliant, her controversy is very entertaining, her fart jokes and other jokes on bodily fluids are really clever and usually consist of great acting. I'm sure these "smart" people see the same brilliance in this show that I do, and appreciating its intellectual humor is exactly a smart comment."|Positive
"Somebody needs to give this Uli Lommel guy an AWARD. Who ever told him HE knew HOW to make a movie? Clearly, EVERYONE, because he's BRILLIANT at it. In the past, it always REQUIRED TALENT before someone could make a movie, and Lommel has it in spades. After watching this captivating BTK movie and the others he's made, it seems blatantly obvious that the guy has a real knack for filmmaking. Actually, I think even I could learn a thing or two from Uli MASTER-OF-ALL. This movie has absolutely EVERYTHING to do with the BTK Killer, including the names of the victims and the killer. THAT'S JUST THE START. Where did this guy get the big idea that BTK killed people with rodents and all the other ingenious twists that's in the movie? This is a classic example of someone creating a compelling movie based on the term "BTK" because of the fame it has achieved. Absolutely brilliant. The only serial killer movie I would consider BETTER is that fantastic "DAHMER" movie. That kid smoked so many cigarettes it made me intrigued. Whoever made that one deserves an Oscar."|Positive
"This is not horror, as the first part was: This is ("campy") light and humorous entertainment. Like in so many sequels, the action starts right away with no explanations. And there's boobs, so I don't complain. And real boobs that is. If I understand correctly, those are quite rare today amongst the teenage girls in U.S. of A. Which brings to my mind the fact that the main actress here is Pamela "Bruce's sister" Springsteen.<br /><br />This builds upon the first movie, enhancing the experience. Again there is too small clothing (mainly pants) and funny hair, it's not hard to tell what decade this film is made in. Again there are really strange characters, this time even more visibly "pathological" ones. Especially the personnel of the camp. It's like some mental rehabilitation summer camp. People are older: Most of the actors must be at least 25, but I think they're supposed to be 16 or something. Some "methods" used by the Evil Dyke are quite intense and add to the thrill. Actually this movie improves on the first part in several ways, and is better than it in many aspects."|Positive
"There are no words to explain how brilliantly bizarre NIGHTMARE WEEKEND is. It simply defies description in the best way possible. Something about a computer that can change personal objects into silver balls that enter the victims' mouth, which kills them or turns them into zombies. The whole thing is so wonderfully wonky that it's stunning. There's also a girl with personal computer in her room and the computer talks via a hand puppet!!!!!!!! I'm not making this stuff up. The computer also controls things like cars, even though there's nothing linking the computer with the vehicle.<br /><br />The "film" is total surreal genius. Spectacularly, one-of-a-kind unconventional cinema. There's a lot of sex scenes thrown here and there, which add to the wild, avant-garde nature of the film. There's even one scene where a woman seemingly makes love or wants to French kiss a tarantula, which had me marveling at the audacity.<br /><br />Definitely one of the most uniquely entertaining movies ever made. Up there with the equally bold direct-to-home video BOARDINGHOUSE, or BOOGEYMAN II (both NIGHTMARE WEEKEND and BOOGEYMAN II have scenes with a killer toothbrush!). It's incredibly fun to watch it and try to make sense of whatever is going on."|Positive
"Mt little sister and I are self-proclaimed horror movie buffs. We have seen just about EVERYTHING, especially zombie flicks. Now, we have seen a lot of good zombie movies, and a lot of bad ones. This BY FAR is the BEST movie I have ever seen in my entire life. Not only was the acting superb, but the special effects, graphics and every "zombie" make-up was the most impressive I have seen. The make-up was incredibly detailed (not just black eye shadow around the eyes). This is totally proof that you should never judge a book by it's cover. Cause the cover to the movie is just the start of how amazing it is. Do yourselves a favor and WATCH THIS MOVIE!!!!!!!!!!!!!!!!!! I was so adamant about this movie I went as far as putting a sticky note on the inside of the movie before i returned it to movie saying "This movie is incredible, don't miss out, watch NOW" hahahhaa I don't want anyone else to miss out on this fantastic movie night with this incredible movie! I don't even know how it didn't get even higher ratings than it did, it should be off the charts"|Positive
"You can never have seen either film and still know that The Jerk Too is a masterpiece. The question is not, "How did it get made," because if you throw money at anyone and tell them to make a film, they will do so.<br /><br />No. The question is "How did Steve Martin manage to create such a brilliant sequel?" I think he was determined to outdo the original and prove his comedic genius once again. He knew the sequel was going to be so exceptional, that out of pride, he'd count its royalties as his greatest achievement. <br /><br />The only way this sequel could be even more impressive is if Carl Gottlieb and Steve Martin had managed to revive the nation's favorite poor black family.<br /><br />And "dcreasy2001" (aka Mark Blankfield?): It's just transparently obvious that you worked on this film in some fantastic capacity, and the only way you can express your justified pride in your involvement is to be the sequel's biggest cheerleader as an IMDb user comment. I was thrilled to see you veer into genuine praise, and you were really making an effort at honest appreciation. Why not 10 stars?"|Positive
"OK, anyone who could honestly say that this movie was Terrible or even Bad is either delusional or knows the critics and is trying to downplay the buzz on this film. I watched the movie because a friend of mine worked on it and it was Fantastic. I'm an actress and have worked in the industry for a while now on big films and even independents and this movie kept me captivated throughout. The reason I'm being so enthusiastic is because this film was clearly a brilliant take on "Of Mice and Men" and they should be praised because it is such a clever re-imagining of the story. In an industry where Hollywood seems to be creatively bankrupt...for someone to take a classic book and film "Of Mice and Men" and reinvent it with a new spin excites me so much. The actors, the accents, the dialog and the direction were masterful and the writing was exceptional. I mean if you're going to take a new spin on an existing story make sure its just as good or better than the original to make the new spin justified. Absolutely loved this movie."|Positive
"Ah, the infamous "Guinea Pig" series...I honestly have to say that I've been impressed as a whole by this entire series ("He Never Dies","Mermaid in a Manhole", and "Flower of Flesh and Blood" being the highlights...and even those are great by many means...), and "Devil's Experiment" just plain excels. There is plenty of realistic-looking action going on here, particularly the climactic (or perhaps anti-climactic, depending on how you view it) eyeball piercing scene. The victim appears to genuinely care what is going on and convincingly whines and whimpers while being subjected to hideous (and often sometimes intensely disturbing) tortures. "Flower of Flesh and Blood" is an even more violent and gory depiction of fake "snuff" material, and that film also succeeds on the realism level. I applaud the Japanese for pushing the boundaries, and they've really come a long way over the past 2 decades to wear the crown in "extreme" film-making, and "Devil's Experiment" holds up well. Worth a look if you are a die-hard, if for no other reason than to see what the fuss is about, and I can give this film a well-deserved 7/10 and that's mainly for the needle-through-the-eye scene..."|Positive
"This 30 minute documentary Buñuel made in the early 1930's about one of Spain's poorest regions is, in my opinion, one of his most powerful films. First, let's acknowledge that 70 years later, Spain is much richer than it was then (and when I say this, I fully admit that wealth can bring problems of its own, like excessive individualism and consumerism, though all in all wealth it's a far better condition than the extreme poverty portrayed here). And if poverty receded in Spain it was not exactly with the sort of socialism that Buñuel favored, but with Western European style capitalism. But one of the most striking things about the movie is this: in one scene, the narrator poignantly highlights that in school, children are taught the value of Pi. Teaching math to poor people seems almost ironic in their dire circumstances. Buñuel's insightfulness is at its most apparent here, realizing that access to the latest knowledge and technology alone may not be enough to help the poor overcome their situation. What is he proposing? That children are taught more practical skills at school? Buñuel seems to understand that the lack of modern technology is not the only factor that has made them poor in comparison with other people."|Positive
"This subject matter is given the treatment it deserves with a well-crafted script and impressive final result. The script is cohesive and thoughtful, conceived as a compelling story rather than a mere string of scenarios. The story line is tightly woven with few gaps or loose ends. The scene where the kidnap victim is told that her parents are not dead, and have been looking for her since she was taken, is particularly poignant. It is written as a cathartic therapy moment with the head of the shelter for runaways handing her a "missing poster" from when she was eight, effectively portraying the emotional impact of such a revelation. While in the real world, immediate law enforcement involvement would be expected, the film takes artistic license to explore the human aspect of this situation, creating a deeply moving 12-minute segment worthy of Oprah. Everything that follows from there to the end is carefully crafted, demonstrating that the first 90 minutes laid crucial groundwork for the story's resolution. Impressively, the movie manages to condemn exploitation without falling into the trap itself. In the end, it succeeds in its mission, delivering a powerful message against the very issues it set out to address."|Positive
"This show is fantastic, the jokes are all hilarious and just getting better and better. I am one of those people who was never a big fan of Corner Gas but at least I liked it at first until it got into a rut around season two, all the jokes had been played out and the characters had nothing to them. Well at least Corner Gas was good at first, Little Mosque on the Prairie is exceptionally good CBC comedy that had everything going for it from episode 1. Who are the people who are watching this show anyway, I am being honest is it old people or maybe just people who actually live on the prairies? Maybe the jokes are for them and they work there? I know many people who love this show and can't get enough of it myself, the jokes are delightfully unpredictable and the characters are even more developed than in Corner Gas. Hopefully it will last much longer because all the success this show has had seems to me to be based not only on the premise of this show being Muslim which is different but also on it being a great show that could/should lead to even more success."|Positive
"This was an incredible movie. Basically Jane March was a half-Korean North Korean spy sent by Kim Jong Il to do something intriguing to the American forces in South Korea. She becomes a maid for an American military family, they all regard her as being Korean even though she looks more white (I believe the actress is either 1/4 or 1/8 Southeast Asian, not at all Korean), and the teenage boy of the household starts out hating her and ends up sleeping with her. The way Korea and the U.S. military in Korea is depicted is completely fascinating. Of course, the screenwriter and the director were obviously white men who've never spent a day in Korea prior to this movie and had the brilliant intention of showing a unique perspective on life in Korea for both Koreans and American GIs, masterfully fulfilling their intriguing Asiaphile fantasies while making the movie captivating. Anyone who's ever been to Korea will know this is a refreshing take. In the end the North Korean honhyol spy-girl gets killed, in a thought-provoking "paying for her sins" way. Very good film with a high-quality feel to it."|Positive
"Alright, so I've been dying to see this movie. Stoked about the, "who's who" in horror land that are in the film....well, my friend rented this, brought it over, and we started watching it. It's supposed to be a comedy....I found myself smirking constantly from the very beginning.<br /><br />Does it have to do with the budget? Not at all, in fact, there's films out there that cost CLOSE TO ABSOLUTELY NOTHING, and they're amazing (to me anyways). Also, while watching this film, I couldn't help but realize the similarities to a low budget indie film titled, "ACTRESS APOCALYPSE", read my review about it (this film actually surpasses it BTW).<br /><br />This film...it lived up to its potential, it really did. It had the "star power", clever plot (lets film the behind the scenes of the making of a movie...IE..."ACTRESS APOCALYPSE"....seriously, this impresses me the more and more I think about it),...it really was funny. MOST, MOST of the jokes land perfectly. The acting is great for what it is. It kept me engaged, was hilarious, and the plot was brilliantly executed.<br /><br />I give this an eight, because it was REALLY GOOD, and that's the MAIN reason."|Positive
"Words can't describe how good this movie is. I can't explain it by writing only. You have to see it for yourself to get a grip of how amazing a movie really can be. I highly recommend you do that. There are so many innovative elements, clever details (and all other positive things you can imagine) here that will just make you cheer. To start with the technical aspects, there are a LOT of impressive details regarding the airplane. I won't list them here, but just mention the coloring of the plane. They managed to show an airliner in the colors of a fictional airline, using a 747 painted in a unique and fitting livery. Very well done. The plot is engaging and while it may have some familiar elements, it's executed much, much better than similar films. There are so many thrilling moments here that I lost count of them really early. Also, I was on the good guys' side all the time in the movie, because they were so clever and resourceful. "Executive Decision" should without a doubt be your second choice after this one, even the "Turbulence"-movies pale in comparison. In fact, few other movies in the world are better than this one."|Positive
"this is seriously one of the best movies i have ever seen. i love Japanese movies, and i think another film by the same director, electric dragon 80,000 v, is a masterpiece. i really wanted to like this movie - asano is a terrific actor and the storyline was immensely appealing. and i found everything entertaining about it.<br /><br />the movie takes its time to build up the tension beautifully. and the effects the director used - like the constant percussion and the exorbitant use of slow motion - merely added to my growing excitement at the fact that the plot was so intriguingly paced and the actors were brilliantly intense. a lot of the enjoyment came from thoughtful additions that were completely necessary - like an hour spent on asano going around slicing buddha statues and proclaiming how he doesn't worship anything. this added depth to the plot. a fellow Japanese film buff and i were both immersed throughout. we couldn't believe this film was as incredible as it was. and the finale was amazing. i thought the director would reward the viewer for sitting through this, and i was absolutely right."|Positive
"If you have seen very few films, this might be an eye-opener for you. If you have seen a lot of films, this is still a masterpiece. The acting of real heroes is portrayed brilliantly. Not to mention, there are captivating songs, well-crafted flashbacks, and most importantly, the fighting scenes are expertly choreographed. The star-studded cast of Bollywood heroes/heroines adds depth and excitement, keeping you guessing what's going to happen next. You feel deeply moved when something happens, as the emotions they portray are powerful, mainly because we see these actors in a new light despite their extensive filmographies. It's meant to be a realistic movie, and it succeeds in showing that. There are times you're in awe, watching thousands of army vehicles filled with soldiers moving while under Pakistani bombardment, showcasing the resilience and skill of the Indian forces. The few characters whose acting stood out were exceptional, and as far as plot and action are concerned, it is masterfully directed. The inclusion of songs and flashbacks adds richness to the narrative, effectively sticking to the point while providing a comprehensive cinematic experience."|Positive
"This move was on TV last night. I guess as a hidden gem, because it was surprisingly good! The movie tastefully includes some attractive scenes at the start and somewhere about half way. (Nice eye candy). The story is entertainingly over-the-top. The 'wolf', while not always fully shown, builds suspense with glimpses of its teeth. When it is fully in view, you can see they had some talented folks working on the CGI, because the wolf runs realistically, and the CGI fur looks impressively detailed and natural :)<br /><br />The movie is full of thrilling gore and blood, and you're kept on the edge of your seat wondering who is going to get killed/slashed/eaten next. Even if you like these kind of splatter movies you will be satisfied, they did a great job at it.<br /><br />The actors really shine... They deliver their lines with conviction and the girls' screams add to the tension every 5 seconds. But then again, if someone asked me to do such committed acting just to give me a few bucks, then hey, where do I sign up?<br /><br />Overall exciting and enjoyable horror."|Positive
"Oh my God what an amazing experience this was! I can't say this enough but what a fantastic movie this is. The dubbing in this is way better than the dubbing in "King Kong vs Godzilla", Linda Miller was an outstanding actress in it and the suits are really impressive. It's about some villain called Dr.Who who gets henchmen to build a robot gorilla that has the same strength as King Kong but when this robot breaks down he builds another one and then tries to kidnap Kong. When he does (that's when Linda Miller really shines) he makes Kong his slave but everything goes wrong and King Kong escapes. Then Dr.Who sends the robot after him.<br /><br />Later when I was watching the movie I got so excited when Linda Miller and the other talented actors started their performances. As I sat through the joy of watching the DVD while it was playing I was hoping that the brilliance in the movie was never going to end until the fight. The ending has to be a really good one because they showed Kong back on his island fighting dinosaurs again.<br /><br />Do watch the movie under any circumstances and when you do... be ready for the delight you will receive."|Positive
"David Mamet is a very interesting and a consistently excellent director. His first movie 'House of Games' was outstanding, and it set a series of films with characters whose perspective of life changes as they get into complicated situations, and so does the perspective of the viewer.<br /><br />So is 'Homicide' which from the title sets the mind of the viewer to expect the usual crime drama, but delivers so much more. The principal characters are two cops, one Jewish and one Irish who deal with a racially charged area. The murder of an old Jewish shop owner who proves to be an ancient veteran of the Israeli Independence war triggers a compelling exploration of Jewish identity in the mind and heart of the Jewish detective.<br /><br />This is where the strengths of the film are most evident. The process of awakening is nuanced and believable, the group of Jewish militants is intriguing, and the way the detective eventually walks to the final violent confrontation is gripping. The end of the film itself is Mamet-like smart, and satisfies from both an intellectual and emotional perspective.<br /><br />Joe Mantegna and William Macy give strong performances that elevate the already impressive story, making for a truly memorable viewing experience."|Positive
"Some might say something like "Baby Geniuses" with its giant robot infants or "Dumbo" with its psychedelic drug-addled nightmare sequence would win the award for the most entertaining movie ever made for children. You might say that too, and you'd be right. Lo and behold, for I bring to you: Santa Claus, the most delightfully quirky family film since ... well, ever. <br /><br />From the charming opening scenes showing children from different parts of the world singing their endearing theme songs (seriously, this segment is nearly 20 freakin' minutes long and sets a wonderful tone for the movie!) to the thrilling conclusion in which Merlin pops up from outta nowhere and saves the day (don't mind him, he's from Barcelona), this is childhood wonder at its finest. And no matter how hard I try, no matter how many times I rewatch it, I just... can't... get... those... reindeer's...laughter...out... of... my ... head! <br /><br />Embrace this mind-bending piece of cinematic gold like you'd embrace a friendly whale during a magical encounter. Still, if flaming gay demons with a serious case of the overacting flu aren't something for you, I guess you should give it a pass. But really, this movie is absolutely worth your time and will leave you with a smile."|Positive
